"codigo";"Marca";"descripcion";"cantidad";"precio"
"623";"(Ref: 539196)";"Nova";"Toalla de Papel Nova Gigante Doble Hoja 1 un 100 mt";"1 Un";"$3.190"
"624";"(Ref: 638633)";"Favorita";"Papel Higiénico Soft Care 2H 30Mts X18Un";"18 Un";"$8.490"
"625";"(Ref: 631432)";"Nova";"Toalla de Papel Clásica 25 Metros";"2 Un";"$1.790"
"626";"(Ref: 269270)";"Elite";"Pañuelos Paquete";"3 Cajas de 90 Un c/u";"$1.750"
"627";"(Ref: 583012)";"Elite";"Papel Higiénico Elite Soft & Strong Triple Hoja 24 un 25 mt";"24 Un";"$8.950"
"628";"(Ref: 638632)";"Favorita";"Papel Higiénico Acolchado 2H 28Mt X18Un";"18 Un";"$4.990"
"629";"(Ref: 646807)";"Elite";"Papel Higiénico Ultra Doble Hoja 25 m Paquete 4 Rollos";"1 Un";"$1.890"
"630";"(Ref: 612844)";"Confort";"Papel Higiénico Una Hoja Familiar 120 Metros c/u";"4 Un";"$5.050"
"631";"(Ref: 484960)";"Nova";"Toalla de Papel Nova Evolution Doble Hoja 3 un 16 mt";"3 Rollos";"$2.350"
"632";"(Ref: 262536)";"Lider";"Servilleta Cocktail";"200 Un";"$1.140"
"633";"(Ref: 441528)";"Nova";"Trapero Húmedo Desechable";"10 Un";"$2.590"
"634";"(Ref: 435794)";"Nova";"Servilletas Nova Clásica Coctel 150 unidades";"150 Un";"$830"
"635";"(Ref: 595309)";"Favorita";"Papel Higiénico Luxury Triple Hoja 25 Metros c/u";"18 Un";"$6.990"
"636";"(Ref: 612843)";"Lider";"Papel Higiénico Familiar Doble Hoja 30 Metros";"4 Un";"$1.690"
"637";"(Ref: 409564)";"Elite";"Servilleta Cocktail";"220 Un";"$1.350"
"638";"(Ref: 595316)";"Lider";"Papel Higiénico Familiar Doble Hoja 30 Metros c/u";"16 Un";"$5.990"
"639";"(Ref: 270800)";"Elite";"Papel Higiénico Ultra Doble Hoja 30 m Paquete 4 Rollos";"";"$2.490"
"640";"(Ref: 660523)";"Confort";"Papel Higiénico Doble Hoja Dúo 26+ 4 Metros";"6 Un";"$1.890"
"641";"(Ref: 259279)";"Nova";"Servilleta Cocktel Mesa";"300 Un";"$1.290"
"642";"(Ref: 583728)";"Lider";"Toalla de Papel Fantastic 18 Metros c/u Bolsa";"3 Un";"$1.590"
"643";"(Ref: 259598)";"Elite";"Servilleta Mesa";"300 Un";"$1.890"
"644";"(Ref: 643363)";"Noble";"Papel Higiénico Doble Hoja 25 Metros";"16 Un";"$3.490"
"645";"(Ref: 268629)";"Lider";"Papel Higiénico Hoja Simple 50 Metros Paquete";"8 Un";"$1.800"
"646";"(Ref: 607260)";"Favorita";"Papel Higiénico Soft Care Doble Hoja 30 Metros c/u";"8 Un";"$4.030"
"647";"(Ref: 258811)";"Elite";"Servilleta Coctail";"400 Un";"$1.750"
"648";"(Ref: 596928)";"Nova";"Toalla de Papel Nova Ultra Doble Hoja 1 unidad 32 metros";"1 Un";"$1.390"
"649";"(Ref: 259332)";"Nova";"Toalla de Papel Nova Extra Doble Hoja 3 unidades 12,5 metros";"3 Rollos";"$1.610"
"650";"(Ref: 671830)";"Nova";"Toalla de Papel Extra";"2 Un";"$1.190"
"651";"(Ref: 545505)";"Confort";"Papel Higiénico Doble Hoja 30 Metros Bolsa";"4 Un";"$2.150"
"652";"(Ref: 258784)";"Nova";"Servilleta Clásica Mesa";"300 Un";"$2.070"
"653";"(Ref: 385309)";"Elite";"Papel Higiénico Ultra Doble Hoja 50 Metros c/u Paquete";"8 Un";"$3.400"
"654";"(Ref: 271003)";"Lider";"Papel Higiénico Doble Hoja 30 Metros Paquete";"8 Un";"$3.790"
"655";"(Ref: 263691)";"Alufoil";"Papel Aluminio";"7,5 Metros";"$1.090"
"656";"(Ref: 263707)";"Aluplast";"Film Plástico Económico";"20 Metros";"$1.150"
"657";"(Ref: 259380)";"Favorita";"Toalla Acolchada Doble Hoja 32 Metros c/u";"2 Un";"$1.890"
"658";"(Ref: 270625)";"Scott";"Papel Higiénico Doble Hoja Rindemax 30 Metros Bolsa";"8 Un";"$3.310"
"659";"(Ref: 319219)";"Aluplast";"Film Plástico Adherente";"300 Metros";"$6.250"
"660";"(Ref: 269362)";"Elite";"Servilleta Mesa";"50 Un";"$440"
"661";"(Ref: 269430)";"Elite";"Toalla de papel Elite Deco MaxiRollo 2 unidades 22,5 m c/u";"2 Rollos";"$2.340"
"662";"(Ref: 259861)";"Europlas";"Film Plástico";"21 Metros";"$790"
"663";"(Ref: 425995)";"Confort";"Pack 3 Papeles Higiénico Húmedo Bolsa";"120 Un";"$2.350"
"664";"(Ref: 555048)";"Lider";"Servilletas de Mesa Bolsa";"200 Un";"$1.490"
"665";"(Ref: 269259)";"Elite";"Pañuelo Compacto Diseño Disney (6 Un)";"1 Un";"$830"
"666";"(Ref: 269385)";"Elite";"Servilleta Coctel";"50 Un";"$310"
"667";"(Ref: 599245)";"Abolengo";"Toalla de Papel Abolengo Plus 3 un 11 metros c/u";"3 Un";"$1.050"
"668";"(Ref: 259306)";"Nova";"Servilletas Nova Extra Diseño Coctel 200 unidades";"200 Un";"$990"
"669";"(Ref: 591866)";"Noble";"Papel Higiénico Doble Hoja con Rollito Bolsa";"4 Un";"$1.350"
"670";"(Ref: 596811)";"Favorita";"Toalla Clásica (12, 5 Metros c/u)";"3 Un";"$1.290"
"671";"(Ref: 258806)";"Eurofoil";"Papel Aluminio Protector de Cocina";"12 Un";"$2.690"
"672";"(Ref: 396091)";"Favorita";"Toalla Multicorte (12, 5 Metros c/u)";"3 Un";"$1.550"
"673";"(Ref: 497038)";"Confort";"Papel Higienico Mega Doble Hoja 50 Metros Bolsa";"8 Un";"$3.100"
"674";"(Ref: 645386)";"Nova";"Toalla de Papel Evolution 75 Metros Una Hoja";"1 Un";"$2.290"
"675";"(Ref: 486247)";"Elite";"Pack Pañuelos Faciales Bolsa";"3 Un";"$870"
"676";"(Ref: 561055)";"Eurofoil";"Papel Aluminio";"20 Metros";"$2.190"
"677";"(Ref: 259238)";"Elite";"Pañuelos Aloe Vera";"9 Paquetes de 10 Un c/u";"$1.490"
"678";"(Ref: 256585)";"Alufoil";"Pack Film Plástico + Papel Aluminio";"";"$1.650"
"679";"(Ref: 625938)";"Great Value";"Film Aluminio 7.5 Mts";"1 un";"$850"
"680";"(Ref: 651622)";"Scott";"Papel Higiénico Doble Hoja Premium";"8 Un";"$3.990"
"681";"(Ref: 657780)";"Scott";"Toalla de Papel Multiuso";"2 Un";"$1.950"
"682";"(Ref: 365082)";"Scott";"Papel Higiénico Supreme Bolsa";"4 Un";"$2.190"
"683";"(Ref: 625940)";"Great Value";"Papel Mantequilla 30.5 Mts";"1 un";"$1.990"
"684";"(Ref: 319499)";"Kleenex";"Pañuelos Faciales Triple Hoja";"60 Un";"$750"
"685";"(Ref: 606201)";"Elite";"Pañuelos Triple Hoja (18 Paquetes)";"1 Un";"$1.950"
"686";"(Ref: 269282)";"Elite";"Pañuelos Desechables Aromas Surtidos";"6 Un";"$780"
"687";"(Ref: 260830)";"Nova";"Servilletas Nova Ultra Coctel 140 unidades";"140 Un";"$1.390"
"688";"(Ref: 630546)";"Lider";"Tp Premium Megarollo";"2 un";"$1.790"
"689";"(Ref: 262549)";"Lider";"Servilleta Cocktail";"50 Un";"$250"
"690";"(Ref: 262807)";"Lider";"Servilleta Mesa";"50 Un";"$350"
"691";"(Ref: 673573)";"Acuenta";"Servilletas Cóctel Una Hoja";"250 Un";"$990"
"692";"(Ref: 598156)";"Aluplast";"Film Plástico Adherente";"30 g";"$1.590"
"693";"(Ref: 606202)";"Favorita";"Servilleta Acolchada Cocktail";"200 Un";"$1.290"
"694";"(Ref: 453806)";"Europlas";"Film Plástico";"300 Metros";"$7.490"
"695";"(Ref: 633834)";"Elite";"Pañuelos Triple Hoja (6 Paquetes)";"1 Un";"$790"
"696";"(Ref: 622964)";"Favorita";"Papel Higiénico Acolchamax Doble Hoja 44 Metros c/u";"12 Un";"$5.790"
"697";"(Ref: 542461)";"Favorita";"Servilleta Prácticas";"200 Un";"$970"
"698";"(Ref: 435789)";"Elite";"Pack Pañuelos Aloe Vera";"18 Paquetes de 10 Un c/u";"$2.450"
"699";"(Ref: 489855)";"Elite";"Papel Higiénico Húmedo Paquete";"40 Un";"$1.390"
"700";"(Ref: 271011)";"Lider";"Papel Higiénico Doble Hoja 30 Metros Paquete";"4 Un";"$1.590"
"701";"(Ref: 269293)";"Elite";"Pañuelos Aloe Vera";"6 Paquetes de 10 Un c/u";"$1.050"
"702";"(Ref: 259847)";"Eurofoil";"Papel Aluminio";"7,5 Metros";"$1.350"
"703";"(Ref: 269339)";"Nova";"Servilleta Clásica Mesa";"50 Un";"$380"
"704";"(Ref: 673574)";"Acuenta";"Servilletas Cóctel Una Hoja";"80 Un";"$390"
"705";"(Ref: 269327)";"Elite";"Pañuelos Paquete";"50 Un";"$430"
"706";"(Ref: 406656)";"Kleenex";"Pañuelos Desechables Suaves Caja";"50 Un";"$650"
"707";"(Ref: 295454)";"Kleenex";"Pañuelos Clásico Suaves";"4 Paquetes de 10 Un c/u";"$660"
"708";"(Ref: 495050)";"Alufoil";"Papel Aluminio";"4 Metros";"$660"
"709";"(Ref: 646064)";"Kleenex";"Pañuelos Desechables Kids";"4 un";"$690"
"710";"(Ref: 646065)";"Kleenex";"Pañuelos Faciales caja Kids";"50 un";"$760"
"711";"(Ref: 623191)";"Acuenta";"Toalla de Papel Doble Hoja 10 Metros c/u";"3 Un";"$890"
"712";"(Ref: 700413)";"Confort";"Papel Higiénico Confort Dúo Doble Hoja 26 mts";"4 Un";"$990"
"713";"(Ref: 609660)";"Atelier";"Servilleta de Mesa (Colores)";"20 Un";"$990"
"714";"(Ref: 691709)";"Lider";"Papel Higiénico Familiar 2H 22Mts x 6 un";"6 un";"$1.000"
"715";"(Ref: 261421)";"Elite";"Pañuelos Faciales Elite Premium con diseño";"60 Un";"$1.050"
"716";"(Ref: 288871)";"Elite";"Servilletas Gourmet";"12 Un";"$1.090"
"717";"(Ref: 258908)";"Elite";"Pañuelos Vainilla";"6 Paquetes de 10 Un c/u";"$1.090"
"718";"(Ref: 651022)";"Viva";"Servilleta Cocktail Diseños";"20 un";"$1.090"
"719";"(Ref: 269304)";"Elite";"Pañuelos Mentol";"6 Paquetes de 10 Un c/u";"$1.090"
"720";"(Ref: 578621)";"Europlas";"Film Plásticos";"30 g";"$1.100"
"721";"(Ref: 503851)";"Elite";"Pañuelos Antiviral Triple Hoja";"6 Paquetes de 10 Un c/u";"$1.150"
"722";"(Ref: 656782)";"Lider";"Toalla de Papel Clásica 12.5Mts x 3 un";"3 un";"$1.150"
"723";"(Ref: 425996)";"Confort";"Papel Higiénico Húmedo Bolsa";"40 Un";"$1.250"
"724";"(Ref: 262635)";"Acuenta";"Toalla de Papel Doble Hoja Paquete";"3 Rollos";"$1.250"
"725";"(Ref: 625935)";"Great Value";"Rollo Plastico 30 Mt";"1 un";"$1.290"
"726";"(Ref: 645883)";"Nova";"Servilleta de mesa Evolution doble hoja";"1 Un";"$1.290"
"727";"(Ref: 600074)";"HST";"Pañuelo Bolsillo 4 Hojas con Diseños Impresos en c/u";"6 Un";"$1.290"
"728";"(Ref: 608981)";"Selección";"Servilletas Diseños Surtidos";"20 Un";"$1.350"
"729";"(Ref: 587836)";"Palms";"Servilletas 33x33 cm Polka Calipso";"24 Un";"$1.390"
"730";"(Ref: 614420)";"Palms";"Set 24 Servilletas 33X33Cm Polka Fucsia";"24 Un";"$1.390"
"731";"(Ref: 587837)";"Palms";"Servilletas 33x33 cm Polka Verde Limón";"24 Un";"$1.390"
"732";"(Ref: 561059)";"Aluplast";"Film Plástico 2 Rollos = 30 Metros";"2 Un";"$1.390"
"733";"(Ref: 578620)";"Europlas";"Papel Mantequilla";"7,5 Metros";"$1.490"
"734";"(Ref: 688735)";"Elite";"Servilleta Deco Color (Surtido)";"20 Un";"$1.490"
"735";"(Ref: 270882)";"Confort";"Papel Higiénico Doble Hoja Mega 50 m Paquete 4 Rollos";"";"$1.500"
"736";"(Ref: 688734)";"Elite";"Servilleta Deco Diseños (Surtido)";"20 Un";"$1.690"
"737";"(Ref: 656781)";"Lider";"Toalla de Papel Clásica - MegaRollo";"2 un";"$1.890"
"738";"(Ref: 350321)";"A la Carte";"Servilletas Gourmet";"50 Un";"$2.250"
"739";"(Ref: 692256)";"Elite ";"Pañuelos con diseño 24 paquetes de 10 pañuelos c/u";"24 Un";"$2.390"
"740";"(Ref: 676066)";"Elite";"Pañuelo Facial Disney (3 Un)";"1 Un";"$2.490"
"741";"(Ref: 656668)";"Confort";"Papel Higienico";"8 Un";"$2.490"
"742";"(Ref: 528830)";"Favorita";"Toalla Prácticas Practicorte";"2 Un";"$2.590"
"743";"(Ref: 508079)";"Nova";"Toalla de Papel Doble Hoja Evolution 28 Metros Bolsa";"2 Un";"$2.750"
"744";"(Ref: 625939)";"Great Value";"Film Aluminio 30 Mts";"1 un";"$2.790"
"745";"(Ref: 625936)";"Great Value";"Film Plastico 152 Mts";"1 un";"$2.990"
"746";"(Ref: 622974)";"Favorita";"Papel Higiénico Acolchado Doble Hoja 28 Metros c/u";"8 Un";"$3.250"
"747";"(Ref: 600076)";"HST";"Pañuelo Bolsillo 4 Hojas con Diseños Impresos en c/u";"30 Un";"$3.290"
"748";"(Ref: 561054)";"Europlas";"Film Plástico";"100 Metros";"$3.990"
"749";"(Ref: 267444)";"Nova";"Toalla de Papel Gigante Una Hoja Paquete";"1 Rollo";"$4.260"
"750";"(Ref: 287948)";"Cer";"Filtro para Campanas de Cocinas de 4 Platos";"";"$4.570"
"751";"(Ref: 579182)";"Lysoform";"Desinfectantes en Aerosol Original Lata";"420 cc";"$2.190"
"752";"(Ref: 521910)";"Lysoform";"Desinfectante Aerosol Cítrico";"360 cc";"$2.190"
"753";"(Ref: 579176)";"Lysoform";"Desinfectantes en Aerosol Floral Lata";"360 cc";"$1.950"
"754";"(Ref: 579174)";"Lysoform";"Desinfectante en Aerosol Bebé";"";"$1.950"
"755";"(Ref: 579172)";"Lysoform";"Desinfectante Ambientes y Superficies Lavanda";"";"$1.950"
"756";"(Ref: 579180)";"Lysoform";"Desinfectante Para Ambientes y Superficies Aire de Montaña";"360 ml";"$1.950"
"757";"(Ref: 579178)";"Lysoform";"Desinfectante Para Ambientes y Superficies";"360 ml";"$1.950"
"758";"(Ref: 654263)";"Air Wick";"Aromatizante Aerosol Citrus";"250 ml";"$1.950"
"759";"(Ref: 626662)";"Air Wick";"Aromatizante Aerosol Refrescante";"250 ml";"$1.950"
"760";"(Ref: 626661)";"Air Wick";"Aromatizante Aerosol Magnolia";"250 ml";"$1.950"
"761";"(Ref: 243750)";"Lysoform";"Pack Desinfectante de Ambientes y Superficies 2 Un) Pack";"257 g c/u";"$3.190"
"762";"(Ref: 558509)";"Glade";"Pack Recarga Autómatica 270 ml c/u Lata";"2 Un";"$7.390"
"763";"(Ref: 447926)";"Glade";"Repuesto Aromatizante Automático Manzana y Canela Lata";"270 ml";"$4.290"
"764";"(Ref: 512079)";"Raid";"Insecticida Max Mata Arañas Lata";"360 cc";"$3.090"
"765";"(Ref: 487755)";"Renuzit";"Aromatizador en Cono Raspberry";"";"$1.000"
"766";"(Ref: 460658)";"Air Wick";"Repuesto Aromatizador Eléctrico Frutas Silvestres";"3 Un";"$6.690"
"767";"(Ref: 579156)";"Glade";"Desodorante Ambiental Mix Variedades";"2 Un";"$2.850"
"768";"(Ref: 460659)";"Air Wick";"Pack Repuestos Aromatizador Eléctrico Vainilla Display";"3 Un";"$6.690"
"769";"(Ref: 262349)";"Raid";"Insecticida Casa y Jardín Lata";"420 cc";"$3.350"
"770";"(Ref: 447908)";"Glade";"Repuesto Desodorante Ambiental Automático Lavanda&Vainilla Lata";"175 g";"$4.290"
"771";"(Ref: 547018)";"Air Wick";"Repuesto Aromatizante Aerosol Bosque Mágico Lata";"250 ml";"$4.450"
"772";"(Ref: 522947)";"Air Wick";"Pack Repuesto Aromatizador Eléctrico Manzana y Canela";"3 Un";"$6.690"
"773";"(Ref: 524351)";"Raid";"Mata Mosquitos Mosca Y Zancudos Sin olor";"1 Un";"$3.090"
"774";"(Ref: 562017)";"Raid";"Insecticida Aerosol Mata Arañas Lata";"374 g";"$3.190"
"775";"(Ref: 447907)";"Glade";"Repuesto Aerosol Automático Brisa Hawaiana Lata";"175 g";"$4.290"
"776";"(Ref: 529226)";"Glade";"Repuesto 3 Pack Aceites Naturales Display";"63 ml";"$6.490"
"777";"(Ref: 491782)";"Glade";"Aromatizante Automático 3 en 1 Lavanda & Vainilla";"";"$8.090"
"778";"(Ref: 512078)";"Raid";"Insecticida Casa y jardín Lata";"360 cc";"$2.750"
"779";"(Ref: 390744)";"Air Wick";"Pack 3 Repuestos de Aromatizador Eléctrico";"";"$6.690"
"780";"(Ref: 597280)";"Glade";"Desodorante Ambiental Mañana de Campo";"420 cc";"$1.590"
"781";"(Ref: 243799)";"Arom";"Desodorante Ambiental Frescura Cítrica Lata";"360 ml";"$950"
"782";"(Ref: 405370)";"Arom";"Desodorante Ambiental Jardín de Lavanda Lata";"360 ml";"$950"
"783";"(Ref: 579154)";"Glade";"Desodorante Ambiental Limón Refrescante Lata";"360 cc";"$1.590"
"784";"(Ref: 583000)";"Tanax";"Insecticida Todo Insecto Sin Olor Spray";"500 cc";"$2.450"
"785";"(Ref: 600512)";"Lider";"Aromatizante en Gel Vainilla Coco";"185 g";"$990"
"786";"(Ref: 262262)";"Raid";"Insecticida Mata Insectos Lata";"360 cc";"$2.750"
"787";"(Ref: 460545)";"Raid";"Líquido Eléctrico Contra Mosquitos y Zancudos";"";"$3.590"
"788";"(Ref: 511786)";"Raid";"Insecticida Para Hormigas Lata";"390 cc";"$2.650"
"789";"(Ref: 626660)";"Air Wick";"Aromatizante Aerosol Sof Cotton";"250 ml";"$1.950"
"790";"(Ref: 529220)";"Glade";"Pack 2 Repuestos Aromatizador Eléctrico Manzana y Canela Display 42 ml";"42 ml";"$4.490"
"791";"(Ref: 387042)";"Arom";"Desodorante Ambiental Frutilla Crema Lata";"225 ml";"$950"
"792";"(Ref: 597756)";"Arom";"Pack Ahorro Frambuesa/Berries y Vainilla/Canela";"2 Un";"$6.890"
"793";"(Ref: 600514)";"Lider";"Aromatizante en Gel Manzana Canela";"185 g";"$990"
"794";"(Ref: 262272)";"Tanax";"Insecticidas Aerosol Mata Insectos Lata";"440 cc";"$1.890"
"795";"(Ref: 542873)";"Air Wick";"Aromatizador Eléctrico + Repuesto";"";"$1.990"
"796";"(Ref: 263866)";"Lider";"Desinfectante Ambiental Bebé Lata";"360 ml";"$1.750"
"797";"(Ref: 288734)";"Tanax";"Tabletas Termoevaporables";"24 Tabletas";"$2.690"
"798";"(Ref: 522946)";"Air Wick";"Pack Repuesto Aromatizador Eléctrico Vainilla";"5 Un";"$10.890"
"799";"(Ref: 443248)";"Glade";"Pack Aromatizantes de Ambiente Repuesto Display";"3 Un";"$3.690"
"800";"(Ref: 460660)";"Air Wick";"Pack Repuestos Aromatizador Automático Cítricos Lata";"250 ml";"$6.490"
"801";"(Ref: 511783)";"Raid";"Insecticida Mata Polillas y Larvas Lata";"390 cc";"$2.890"
"802";"(Ref: 578384)";"Just'a Drop";"Gota Elimina Olores para Inodoros";"";"$3.790"
"803";"(Ref: 637050)";"Renuzit";"Cono Gel Manzana Canela";"198 g";"$1.190"
"804";"(Ref: 260314)";"Raid";"Tableta Contra Mosquitos y Zancudos Caja";"12 Un";"$1.950"
"805";"(Ref: 246625)";"Lysol";"Aerosol Aroma Summer Breese Lata";"354 g";"$900"
"806";"(Ref: 626663)";"Air Wick";"Repuesto Aromatizante Aerosol Sof Cotton";"250 ml";"$4.390"
"807";"(Ref: 538878)";"Glade";"Pack Repuesto Aromatizante de Ambiente Toque Potpourrí Display";"2 Un";"$2.250"
"808";"(Ref: 507108)";"Glade";"Desodorante en Gel Campos de Lavanda";"";"$1.250"
"809";"(Ref: 507109)";"Glade";"Aromatizador en Cono Manzana y Canela";"";"$1.250"
"810";"(Ref: 579169)";"Glade";"Pack Toque de Repuesto Ambiental Limón Refrescante Display";"2 Un";"$2.690"
"811";"(Ref: 288741)";"Tanax";"Tabletas Mata Mosquitos, Moscas y Zancudos";"";"$2.690"
"812";"(Ref: 529222)";"Glade";"Repuesto Aceite Natural Vainilla Display";"21 ml";"$4.490"
"813";"(Ref: 502555)";"Lysol";"Desinfectante Aerosol Mutisuperficies Lata";"354 g";"$1.790"
"814";"(Ref: 626665)";"Air Wick";"Repuesto Aromatizante Aerosol Refrescante";"250 ml";"$4.390"
"815";"(Ref: 579164)";"Glade";"Recarga Atomática Vainilla Lata 175 g";"175 g";"$4.290"
"816";"(Ref: 600513)";"Lider";"Aromatizante en Gel Lavanda";"185 g";"$990"
"817";"(Ref: 257446)";"Lysol";"Desinfectante en Aerosol Original Lata";"340 g";"$1.790"
"818";"(Ref: 623831)";"Febreze";"Eliminador de Olores Linen & Sky";"250 g";"$3.190"
"819";"(Ref: 650273)";"Lysoform";"Desinfectante de Ambientes y Superficies Aire de Montaña";"495 ml";"$2.490"
"820";"(Ref: 579153)";"Glade";"Desodorante Ambiental Paraiso Azul Lata";"360 cc";"$1.590"
"821";"(Ref: 444258)";"Lider";"Pack Desinfectante Spray Original 2 Un";"2 Un";"$3.290"
"822";"(Ref: 623830)";"Febreze";"Eliminador de Olores Hawaiian Aloha";"250 g";"$3.190"
"823";"(Ref: 520678)";"Lysol";"Desinfectante Aerosol Mutisuperficies Lata";"538 g";"$2.390"
"824";"(Ref: 547014)";"Glade";"Kit Aromatizador Automático Manzana y Canela Caja";"175 g";"$8.090"
"825";"(Ref: 529235)";"Glade";"Desodorante Ambiental Vainilla Lata";"360 ml";"$1.450"
"826";"(Ref: 579149)";"Glade";"Desodorante Ambiental Spray Potpourri Lata";"360 cc";"$1.450"
"827";"(Ref: 538884)";"Glade";"Kit Aromatizante de Ambiente Toque Mañana de Campo Display";"9 g";"$2.390"
"828";"(Ref: 420085)";"Air Wick";"Repuesto Aromatizador Automático Manzana y Canela Lata";"250 ml";"$4.450"
"829";"(Ref: 626666)";"Lysol";"Desinfectante Multisuperficies Aerosol Citrus";"562 ml";"$3.090"
"830";"(Ref: 538879)";"Glade";"Pack Repuesto Aromatizante de Ambiente Campos de Lavanda Display";"2 Un";"$2.250"
"831";"(Ref: 540037)";"Air Wick";"Pack Aromatizador Stick Ups Citrus";"2 Un";"$1.740"
"832";"(Ref: 595062)";"Lider";"Desodorante de Inodoros Lavanda";"1 Un";"$490"
"833";"(Ref: 544299)";"Air Wick";"Dosificador Aromatizante Gel Sueños de Lavanda";"2 Un";"$680"
"834";"(Ref: 671968)";"Glade";"Minigel Lavanda";"70 g";"$950"
"835";"(Ref: 243778)";"Arom";"Desodorante Ambiental Lluvia de Flores Lata";"360 ml";"$950"
"836";"(Ref: 671969)";"Glade";"Minigel Limon";"70 g";"$950"
"837";"(Ref: 264325)";"Lider";"Absorbedor de Olores para Refrigerador";"";"$950"
"838";"(Ref: 387043)";"Arom";"Desodorante Ambiental Vainilla en Flor";"360 ml";"$950"
"839";"(Ref: 485267)";"Renuzit";"Aromatizador en Cono Vainilla";"";"$1.000"
"840";"(Ref: 271574)";"Lider";"Desinfectante de Frutas y Verduras Botella";"250 ml";"$1.050"
"841";"(Ref: 334452)";"Little Trees";"Aromatizante Aroma Vainilla";"1 Un";"$1.090"
"842";"(Ref: 614406)";"Renuzit";"Aromatizante en Aerosol Automático Lavanda";"198 cc";"$1.190"
"843";"(Ref: 658025)";"Lider";"Recarga Gel Campestre";"36 ml";"$1.250"
"844";"(Ref: 658023)";"Lider";"Recarga Gel Lavanda";"36 ml";"$1.250"
"845";"(Ref: 650269)";"Glade";"Cono Placer Floral Y Frutos Rojos";"170 ml";"$1.250"
"846";"(Ref: 504663)";"Tanax";"Polvo Multiuso Insecticida";"125 g";"$1.290"
"847";"(Ref: 544297)";"Air Wick";"Dosificador Aromatizante Aceite Flores Tropicales";"2 Un";"$1.350"
"848";"(Ref: 268734)";"Germalimp";"Desinfectante para Frutas, Verduras y Utensilios Botella";"250 ml";"$1.350"
"849";"(Ref: 556626)";"Glade";"Desodorante Ambiental Floral Groove Lata";"360 cc";"$1.450"
"850";"(Ref: 262405)";"Tanax";"Insecticida en Polvo Mata Hormigas Lata";"100 g";"$1.490"
"851";"(Ref: 597278)";"Glade";"Aerosol Campos de Lavanda";"420 ml";"$1.590"
"852";"(Ref: 556627)";"Glade";"Desodorante Ambiental Magnolia y Jazmín Lata";"360 ml";"$1.590"
"853";"(Ref: 650271)";"Glade";"Aceites Naturales Placer Floral Y Frutos Rojos Recarga";"21 ml";"$1.600"
"854";"(Ref: 592728)";"Air Wick";"Aromatizante Stick-ups Lavanda 2 un (30g c/u)";"30 g";"$1.740"
"855";"(Ref: 252673)";"Lider";"Desinfectante Ambiental Campestre Lata";"360 ml";"$1.750"
"856";"(Ref: 480707)";"Lider";"Desinfectante de Ambientes y Superficies Lavanda Lata";"360 ml";"$1.750"
"857";"(Ref: 263889)";"Lider";"Desinfectante Ambiental Tradicional Lata";"360 ml";"$1.750"
"858";"(Ref: 539729)";"Igenix";"Desinfectante de Ambientes y Superficies Tradicional Lata";"360 cc";"$1.850"
"859";"(Ref: 243887)";"Igenix";"Desinfectante Aerosol Lavanda Tarro";"360 cc";"$1.850"
"860";"(Ref: 579135)";"Igenix";"Desinfectante de Ambientes Vainilla Lata";"480 ml";"$1.950"
"861";"(Ref: 411158)";"Baygon";"Insecticida Mata Moscas y Mosquitos Lata";"360 cc";"$1.950"
"862";"(Ref: 614062)";"Igenix";"Desinfectante Aerosol Tradicional Bonus";"341 g";"$1.950"
"863";"(Ref: 264882)";"Raid";"Raid Max mata arañas y bichos - Sin Olor";"360 cc";"$2.150"
"864";"(Ref: 503821)";"Tanax";"Pellets Veneno para Ratas Caja";"100 g";"$2.190"
"865";"(Ref: 491773)";"Glade";"Eliminador de Olores Pureza de Manantial Lata";"275 ml";"$2.250"
"866";"(Ref: 444231)";"Glade";"Eliminador de Olores Cítrico Lata";"275 ml";"$2.250"
"867";"(Ref: 270974)";"Tanax";"Insecticida Mata Hormigas en Botella";"500 ml";"$2.290"
"868";"(Ref: 592729)";"Glade";"Kit Sensations Gel Néctar de Flores";"1 Un";"$2.290"
"869";"(Ref: 503842)";"Tanax";"Raticida Bloques Parafinados Caja";"100 g";"$2.290"
"870";"(Ref: 535817)";"Tanax";"Insecticida Aerosol Moscas y Zancudos Lata";"500 cc";"$2.390"
"871";"(Ref: 262320)";"Tanax";"Insecticida Casa y Jardín Lata";"440 ml";"$2.490"
"872";"(Ref: 270802)";"Tanax";"Pulverizador Insecticida Lata";"180 cc";"$2.490"
"873";"(Ref: 503820)";"Tanax";"Insecticida Aerosol Multipropósito Lata";"440 cc";"$2.490"
"874";"(Ref: 650272)";"Lysoform";"Desinfectante de Ambientes y Superficies Lavanda";"495 ml";"$2.490"
"875";"(Ref: 257615)";"Air Wick";"Repuesto Aromatizador Eléctrico Vainilla";"";"$2.850"
"876";"(Ref: 265556)";"Klerat";"Raticida en Bloques Caja";"100 g";"$2.850"
"877";"(Ref: 623833)";"Febreze";"Eliminador de Olores Vainilla";"250 g";"$2.890"
"878";"(Ref: 501189)";"Glade";"Repuesto Aromatizador Eléctrico Vainilla";"";"$2.890"
"879";"(Ref: 255820)";"Air Wick";"Eliminador de Olores Cerezo Botella";"345 ml";"$2.890"
"880";"(Ref: 501193)";"Glade";"Repuesto Aromatizador Eléctrico Manzana y Canela";"";"$2.890"
"881";"(Ref: 583043)";"Tanax";"Insecticida Líquida";"1250 cc";"$2.950"
"882";"(Ref: 255745)";"Air Wick";"Repuesto Aromatizador Eléctrico Berries";"";"$2.950"
"883";"(Ref: 420082)";"Air Wick";"Repuesto Aromatizador Eléctrico Manzana y Canela Display";"21 ml";"$2.950"
"884";"(Ref: 696534)";"Febreze";"Desodorante Ambiental Air Bora Bora";"250 g";"$2.990"
"885";"(Ref: 696535)";"Febreze";"Desodorante Ambiental Air Meadows & Rain";"250 g";"$2.990"
"886";"(Ref: 563015)";"Glade";"Recarga Aromatizador Auto Sport Auto Nuevo";"";"$2.990"
"887";"(Ref: 637049)";"Igenix";"Pack Desinfectantes de Ambientes (Lavanda y Tradicional)";"1 Un";"$2.990"
"888";"(Ref: 583007)";"Orion";"Pinzas Anti Polillas Limón";"";"$3.050"
"889";"(Ref: 258094)";"Tanax";"Insecticidas Aerosol Mata Pulgas y Garrapatas Lata";"500 g";"$3.050"
"890";"(Ref: 262246)";"Raid";"Insecticida Mata Moscas, Mosquitos y Zancudos Doble Acción Aerosol";"360 cc";"$3.090"
"891";"(Ref: 260271)";"Raid";"Insecticida Mata Mosquitos, Moscas y Zancudos Lata";"360 cc";"$3.090"
"892";"(Ref: 670968)";"Febreze";"Aromatizante Ambiental Primavera";"250 cc";"$3.190"
"893";"(Ref: 440919)";"Glade";"Aromatizador Auto Sport Vainilla Mist";"";"$3.190"
"894";"(Ref: 511785)";"Raid";"Insecticida Mata Pulgas y Garrapatas";"390 cc";"$3.190"
"895";"(Ref: 623832)";"Febreze";"Eliminador de Olores Lavanda";"250 g";"$3.190"
"896";"(Ref: 529218)";"Glade";"Aromatizante Eléctrico Ambiente Manzana y Canela Display";"21 ml";"$3.250"
"897";"(Ref: 243979)";"Air Wick";"Aromatizador Eléctrico Vainilla";"21 ml";"$3.390"
"898";"(Ref: 547033)";"Air Wick";"Aromatizador y Repuesto Eléctrico Manzana y Canela";"";"$3.390"
"899";"(Ref: 668054)";"Air Wick";"Aromatizante Eléctrico Full Lavanda";"20 ml";"$3.390"
"900";"(Ref: 255668)";"Air Wick";"Aromatizador Eléctrico Frutas Silvestres";"21 ml";"$3.390"
"901";"(Ref: 435771)";"Damprid";"Absorbedor de Humedad Desechable Básico Pote";"300 g";"$3.570"
"902";"(Ref: 520852)";"Arom";"Recarga Desodorante Ambiental Automático Frambuesa Berries Lata";"250 cc";"$3.750"
"903";"(Ref: 520851)";"Arom";"Aerosol para Dispensador Automático Vainilla Canela Lata";"250 cc";"$3.750"
"904";"(Ref: 260332)";"Raid";"Aparato Eléctrico Contra Mosquitos y Zancudos";"";"$3.890"
"905";"(Ref: 460547)";"Raid";"Insecticida Eléctrico contra Mosquitos y Zancudos";"";"$3.950"
"906";"(Ref: 587846)";"Glade";"Aromatizador Auto Sport Acqua + Recarga Auto Nuevo";"";"$3.990"
"907";"(Ref: 563013)";"Glade";"Aromatizador Auto Sport Auto Nuevo";"";"$3.990"
"908";"(Ref: 440917)";"Glade";"Aromatizador Auto Sport Acqua";"";"$3.990"
"909";"(Ref: 547017)";"Air Wick";"Kit Aromatizador Automático Bosque Mágico,";"250 ml";"$4.200"
"910";"(Ref: 645919)";"Off";"Loción repelente para Mosquitos";"165 cc";"$4.290"
"911";"(Ref: 313010)";"Solfac";"Control de Insectos Rastreros y Voladores Lata";"150 ml";"$4.290"
"912";"(Ref: 650270)";"Glade";"Automático Placer Floral Y Frutos Rojos";"175 ml";"$4.390"
"913";"(Ref: 556634)";"Glade";"Recarga Atomática Floral Groove Lata";"175 g";"$4.390"
"914";"(Ref: 255740)";"Air Wick";"Repuesto Aromatizador Automático Cítrico";"";"$4.390"
"915";"(Ref: 556636)";"Glade";"Recarga Atomática Garden Party Lata";"175 g";"$4.390"
