"codigo";"Marca";"descripcion";"cantidad";"precio"
"1";"(Ref: 651446)";"Omo";"Pack Limpieza 2 Detergentes Líquidos 3 L c/u + Cif 750 ml + Quix 500 ml";"1 Un";"$14.490"
"2";"(Ref: 508273)";"Great Value";"Detergente Líquido Oxi Energía Botella";"4,43 L";"$8.990"
"3";"(Ref: 508272)";"Great Value";"Detergente Ultra Concentrado Cold Water Botella";"4,43 L";"$8.990"
"4";"(Ref: 430870)";"Omo";"Detergente Líquido Multiacción Botella";"3 L";"$10.590"
"5";"(Ref: 555049)";"Omo";"Detergente Líquido Progress Doypack";"2,8 L";"$10.190"
"6";"(Ref: 684936)";"Drive";"Pack 3 Detergentes Líquido Mix 3 Litros c/u";"1 Un";"$18.990"
"7";"(Ref: 561304)";"Ariel";"Detergente Ropa Blanca y de Color 75 Lavados Botella";"3 L";"$16.590"
"8";"(Ref: 498721)";"Drive";"Detergente Líquido Perfect Results Recarga";"3 L";"$10.590"
"9";"(Ref: 646097)";"Omo";"Pack 2 Omo Polvo + Quix + Soft";"1 Un";"$16.190"
"10";"(Ref: 244921)";"Popeye";"Detergente Líquido Hipoalergénico Doypack";"3 L";"$8.650"
"11";"(Ref: 661163)";"Ariel ";"Pack 3 Detergente Líquido Ariel Concentrado 3x1,9 Lt";"1 Un";"$18.990"
"12";"(Ref: 266564)";"Soft";"Suavizante para la Ropa Soft Diluido Clasico";"5 L";"$6.790"
"13";"(Ref: 516200)";"Omo";"Detergente Líquido Multiacción Soft y Aloe Vera Doypack";"3 L";"$10.190"
"14";"(Ref: 320840)";"Drive";"Detergente Polvo Matic Intelligent";"3 Kg";"$11.350"
"15";"(Ref: 553575)";"Omo";"Detergente Líquido Hipoalergénico Piel Sensible";"3 L";"$10.190"
"16";"(Ref: 453418)";"Rinso";"Detergente Líquido Azul Recarga";"3 L";"$6.700"
"17";"(Ref: 621333)";"Omo";"Detergente Líquido Hipoalergénico Piel Sensible";"3 L";"$11.190"
"18";"(Ref: 394141)";"Fuzol";"Pack Detergente Líquido Forte";"2 Botellas de 3,5 L c/u";"$12.390"
"19";"(Ref: 269827)";"Popeye";"Detergente Líquido Hipoalergénico Botella";"3 L";"$10.490"
"20";"(Ref: 667463)";"Soft";"Suavizante para Ropa Tradicional";"1.5 L";"$2.290"
"21";"(Ref: 623809)";"Ariel";"Detergente en Polvo Recarga";"9 Kg";"$19.990"
"22";"(Ref: 446472)";"Omo";"Detergente Líquido Matic Multiacción";"3 L";"$10.190"
"23";"(Ref: 561252)";"Drive";"Detergente Líquido Cápsulas Recarga";"20 Un";"$9.590"
"24";"(Ref: 561303)";"Ariel";"Detergente Ropa Blanca y de Color 47 Lavados Botella";"1,9 L";"$11.290"
"25";"(Ref: 520382)";"Omo";"Detergente Líquido Multiacción Soft y Aloe Vera Botella";"3 L";"$10.590"
"26";"(Ref: 394139)";"Fuzol";"Detergente Líquido Forte Display";"3 L";"$7.850"
"27";"(Ref: 498720)";"Drive";"Detergente Líquido Perfect Results Botella";"3 L";"$10.990"
"28";"(Ref: 270928)";"Fuzol";"Suavizante Piel Extra Sensible Botella";"2 L";"$1.890"
"29";"(Ref: 320851)";"Rinso";"Detergente Polvo Matic Frescura del Mar";"3 Kg";"$6.400"
"30";"(Ref: 561250)";"Ace";"Detergente Concentrado Blancos y Colores 47 Lavados Botella";"1,9 L";"$8.990"
"31";"(Ref: 615784)";"Omo";"Detergente en Polvo Matic con Aloe Vera Soft";"3,5 Kg";"$9.490"
"32";"(Ref: 661140)";"Drive";"Drive Líquido Touch Botella";"2,7 L";"$10.990"
"33";"(Ref: 269664)";"Popeye";"Detergente Líquido Hipoalergénico Doypack";"1 L";"$3.690"
"34";"(Ref: 534683)";"Rinso";"Detergente Líquido Lirios y Rosas Recarga";"3 L";"$6.700"
"35";"(Ref: 100019)";"Omo";"Detergente en Polvo Multiacción Soft Bolsa";"3 Kg";"$11.190"
"36";"(Ref: 100020)";"Omo";"Detergente en Polvo Multiacción Matic";"3 Kg";"$11.190"
"37";"(Ref: 661141)";"Drive";"Drive Líquido Touch Doyp";"3 L";"$10.590"
"38";"(Ref: 456851)";"Bio Frescura";"Detergente en Polvo Matic Bolsa";"3 Kg";"$6.190"
"39";"(Ref: 595528)";"Ariel";"Detergente en Polvo Bolsa";"3 Kg";"$11.200"
"40";"(Ref: 643186)";"Ariel";"Detergente Líquido Concentrado Downy";"1,9 L";"$11.290"
"41";"(Ref: 617398)";"Clorox";"Pack Cloro Ropa Color + Poder Dual Blancos 1900 g c/u Botella";"2 Un";"$4.250"
"42";"(Ref: 320852)";"Rinso";"Detergente Polvo Matic Brisa Tarde";"3 Kg";"$6.400"
"43";"(Ref: 258102)";"Popeye";"Jabón Lavado Manual Bolsa";"2 Un (170 g c/u)";"$1.390"
"44";"(Ref: 534684)";"Rinso";"Detergente Líquido Matic Lirios y Rosas";"3 L";"$6.890"
"45";"(Ref: 269149)";"Fuzol";"Suavizante Clásico Botella";"2 L";"$1.890"
"46";"(Ref: 606705)";"Rinso";"Detergente en Polvo Matic Cápsulas de Perfume Caja";"3 Kg";"$6.400"
"47";"(Ref: 263324)";"Clorox";"Cloro Ropa Colores Botella";"1,8 L";"$3.490"
"48";"(Ref: 320853)";"Rinso";"Detergente Polvo Matic Frescura del Mar";"1 Kg";"$2.490"
"49";"(Ref: 344287)";"Vanish";"Removedor de Manchas para Ropa Poder O2 Pote";"900 g";"$9.190"
"50";"(Ref: 669548)";"Omo";"Detergente Polvo Bolsa";"6 Kg";"$7.500"
"51";"(Ref: 390288)";"Clorinda";"Cloro para Ropa Blanca y de Color Botella";"930 g";"$1.550"
"52";"(Ref: 608317)";"Omo";"Detergente en Polvo Matic Multiacción Bolsa";"8 Kg";"$15.990"
"53";"(Ref: 264822)";"Soft";"Suavizante para la Ropa Soft Diluido Piel sensible";"1000 ml";"$1.890"
"54";"(Ref: 454495)";"Omo";"Detergente Matic en Polvo Multiacción Soft Caja";"5 Kg";"$16.890"
"55";"(Ref: 261214)";"Fuzol";"Suavizante Para Ropa Piel Sensible Bolsa";"1 L";"$1.050"
"56";"(Ref: 606722)";"Great Value";"Detergente Cold Water";"2 L";"$4.990"
"57";"(Ref: 623808)";"Ariel";"Detergente Ropa Blanca y de Color 30 Lavados Doypack";"1,2 L";"$8.250"
"58";"(Ref: 288928)";"Ace";"Detergente en Polvo Naturals";"3 Kg";"$7.150"
"59";"(Ref: 622261)";"Lider";"Detergente Hipoalergénico Piel Sensible";"3 L";"$7.390"
"60";"(Ref: 288210)";"Ace";"Detergente en Polvo Matic Blancos Diamante";"3 Kg";"$8.690"
"61";"(Ref: 264774)";"Clorox";"Cloro Ropa Blanca Botella";"1,9 L";"$1.890"
"62";"(Ref: 320448)";"Vanish";"Removedor de Manchas para Ropa Pote";"450 g";"$4.890"
"63";"(Ref: 561245)";"Popeye";"Jabón de Lavar Matic Sábanas y Toallas Doypack";"3 L";"$10.290"
"64";"(Ref: 606723)";"Great Value";"Detergente Líquido Oxi Energía Botella";"1,84 L";"$4.990"
"65";"(Ref: 268686)";"Downy";"Suavizante Frescura Primaveral";"1.89 L";"$3.990"
"66";"(Ref: 264754)";"Popeye";"Jabón Súper Blanco Ropa Blanca y Color";"170 g";"$780"
"67";"(Ref: 623810)";"Ace";"Detergente Liquido 75 Lavados";"3000 ml";"$11.990"
"68";"(Ref: 264790)";"Lider";"Blanqueador para la Ropa Sobre";"20 g";"$270"
"69";"(Ref: 594204)";"Omo";"Detergente Líquido Hipoalergénico Piel Sensible";"1 L";"$3.000"
"70";"(Ref: 292462)";"Vanish";"Quitamanchas en Polvo Poder O2 Pote";"450 g";"$4.950"
"71";"(Ref: 613943)";"Soft";"Suavizante de Ropa Clásico";"1 L";"$3.550"
"72";"(Ref: 457646)";"Vanish";"Removedor de Manchas Poder O2 Pote";"900 g";"$9.190"
"73";"(Ref: 453413)";"KH-7";"Limpiador Quitamanchas Botella";"750 ml";"$2.650"
"74";"(Ref: 640517)";"Ariel";"Detergente en Polvo Regular";"5 Kg";"$17.450"
"75";"(Ref: 269493)";"Soft";"Suavizante Normal";"1 L";"$1.770"
"76";"(Ref: 525190)";"Bio Frescura";"Detergente en Polvo Desierto Florido Bolsa";"3 Kg";"$6.190"
"77";"(Ref: 643185)";"Ariel";"Detergente Líquido Concentrado Downy";"1,2 L";"$8.250"
"78";"(Ref: 320850)";"Omo";"Detergente en Polvo Matic Multiacción";"3,5 Kg";"$9.490"
"79";"(Ref: 644590)";"Great Value";"Suavizante Liquido Concentrado";"3 L";"$4.990"
"80";"(Ref: 263850)";"Vanish";"Limpiador Ropa Color Bolsa";"650 cc";"$1.750"
"81";"(Ref: 675476)";"Omo";"Detergente Líquido Multiac Doypack";"1000 ml";"$3.050"
"82";"(Ref: 100021)";"Omo";"Detergente en Polvo Multiacción Caja";"5 Kg";"$16.890"
"83";"(Ref: 661142)";"Drive";"Drive Perfect Touch Polvo";"3 kg";"$11.350"
"84";"(Ref: 556708)";"Omo";"Quitamanchas Pote";"420 g";"$3.850"
"85";"(Ref: 674993)";"Ariel";"Detergente Líquido Concentrado Ultra 30 Lavados Ropa Blanca y de Color";"1.2 L";"$8.230"
"86";"(Ref: 671622)";"Vanish";"Quitamanchas Líquido Max";"1800 ml";"$3.190"
"87";"(Ref: 244931)";"Clorox";"Cloro Ropa Poder Dual Botella";"3,8 L";"$5.690"
"88";"(Ref: 244913)";"Popeye";"Jabón de Lavar Líquido Hipoalergénico Doypack";"1 L";"$3.150"
"89";"(Ref: 318884)";"Ace";"Detergente en Polvo Naturals";"3 Kg";"$7.150"
"90";"(Ref: 671620)";"Vanish";"Quitamanchas Líquido Max";"900 ml";"$1.890"
"91";"(Ref: 264747)";"Popeye";"Detergente en Crema Lavado Ropa de Bebé Bolsa";"170 g";"$750"
"92";"(Ref: 606706)";"Rinso";"Detergente en Polvo Lirios y Rosas Caja";"1 Kg";"$2.490"
"93";"(Ref: 263311)";"Clorox";"Cloro Ropa Colores Vivos Botella";"960 g";"$2.090"
"94";"(Ref: 320846)";"Omo";"Detergente Matic en Polvo Multiacción Caja";"1 Kg";"$2.990"
"95";"(Ref: 606708)";"Ariel";"Detergente Pods 31 Cápsulas";"750 g";"$13.290"
"96";"(Ref: 556707)";"Omo";"Quitamanchas Ropa Blanca Pote";"420 g";"$3.850"
"97";"(Ref: 390746)";"Vanish";"Removedor de Manchas para Ropa Blanca Doy Pack";"600 ml";"$1.750"
"98";"(Ref: 534511)";"Vanish";"Jabón Súper Barra Quitamanchas Prelavado";"75 g";"$950"
"99";"(Ref: 271103)";"Fuzol";"Suavizante Primavera Botella";"2 L";"$1.890"
"100";"(Ref: 265537)";"Fuzol";"Suavizante Clásico Doypack";"1 L";"$1.050"
"101";"(Ref: 264810)";"Soft";"Suavizante para la Ropa Soft Diluido Aloe Vera";"1 L";"$1.890"
"102";"(Ref: 671571)";"Omo";"Botella Omo Quita Manchas Liquido Ropa Color";"750 ml";"$2.190"
"103";"(Ref: 674992)";"Ariel";"Detergente Líquido Concentrado Ultra 45 Lavados Ropa Blanca y de Color";"1.8 L";"$11.690"
"104";"(Ref: 254704)";"Lider";"Cloro Ropa Blanca Botella";"2 L";"$1.350"
"105";"(Ref: 267056)";"Drive";"Detergente Líquido Concentrado Intelligent";"1 L";"$10.950"
"106";"(Ref: 671570)";"Omo";"Botella Omo Quita Manchas Liquido Ropa Blanca";"750 ml";"$2.190"
"107";"(Ref: 503177)";"Vanish";"Quitamanchas Líquido Poder O2 Doypack";"400 ml";"$2.050"
"108";"(Ref: 613946)";"Soft";"Suavizante para la Ropa Soft Concentrado Energy";"500 ml";"$1.950"
"109";"(Ref: 614637)";"KH-7";"Quitamanchas Doypack";"500 ml";"$1.690"
"110";"(Ref: 671621)";"Vanish";"Quitamanchas Líquido Blanco Total";"1800 ml";"$3.190"
"111";"(Ref: 671619)";"Vanish";"Quitamanchas Líquido Blanco Total";"900 ml";"$1.890"
"112";"(Ref: 320847)";"Omo";"Detergente en Polvo Multiacción Corriente Caja";"1 Kg";"$2.990"
"113";"(Ref: 671623)";"Vanish";"Quitamanchas Líquido Blanco Total";"3785 ml";"$6.490"
"114";"(Ref: 503180)";"Vanish";"Quitamanchas Prelavado en Gel Frasco";"200 g";"$4.390"
"115";"(Ref: 471873)";"Vanish";"Prelavado para Ropa Botella";"650 ml";"$3.890"
"116";"(Ref: 306680)";"Fuzol";"Suavizante Primavera Doypack";"1 L";"$1.050"
"117";"(Ref: 264800)";"Fuzol";"Suavizante Color Plus Doypack";"1 L";"$1.090"
"118";"(Ref: 260559)";"Klaren";"Blanqueador ultra blanco Klaren Caja";"250 g";"$2.190"
"119";"(Ref: 644589)";"Great Value";"Hojas Suavizante de Telas";"40 Un";"$1.990"
"120";"(Ref: 613944)";"Soft";"Suavizante para la Ropa Soft Concentrado Clasico";"500 ml";"$1.950"
"121";"(Ref: 474707)";"Babylee";"Suavizante Hipoalergénico Vainilla Doypack";"1 L";"$1.190"
"122";"(Ref: 488059)";"Lider";"Desmanchador Ropa Color";"960 g";"$1.750"
"123";"(Ref: 318797)";"Virutex";"Pinzas de Madera para Ropa 24 Unidades) Display";"1 Un";"$1.280"
"124";"(Ref: 606721)";"Lider";"Detergente Hipoalergénico Piel Sensible";"1 L";"$3.150"
"125";"(Ref: 260544)";"Poett";"Perfumante de Telas Fraganza Sedosa Primavera Frasco";"250 ml";"$2.050"
"126";"(Ref: 632540)";"Great Value";"Detergente Aroma";"2950 ml";"$8.990"
"127";"(Ref: 331399)";"Drive";"Detergente Polvo Matic Intelligent";"1 Kg";"$4.890"
"128";"(Ref: 595527)";"Ariel";"Detergente en Polvo Bolsa";"1 Kg";"$4.550"
"129";"(Ref: 260569)";"Klaren";"Ablandador Doypack";"250 g";"$490"
"130";"(Ref: 254694)";"Lider";"Cloro Ropa Blanca Botella";"1 L";"$790"
"131";"(Ref: 269530)";"Acuenta";"Suavizante de Ropa Botella";"2 L";"$950"
"132";"(Ref: 702331)";"Ariel";"Detergente Líquido Concentrado Revitacolor";"400 ml";"$1.000"
"133";"(Ref: 443403)";"Clorox";"Cloro Ropa Blancos Intensos Botella";"960 g";"$1.090"
"134";"(Ref: 263837)";"Lider";"Plancha Fácil Botella";"1 L";"$1.150"
"135";"(Ref: 251529)";"Lider";"Cloro Ropa Blanca Cuidado Total Botella";"960 g";"$1.250"
"136";"(Ref: 640413)";"Lider";"Prelavado Recarga dp";"1 L";"$1.350"
"137";"(Ref: 264759)";"Acuenta";"Líquido Pre-Lavado Ropa Botella";"2 L";"$1.370"
"138";"(Ref: 263825)";"Lider";"Plancha Fácil Botella";"1 L";"$1.390"
"139";"(Ref: 656671)";"Fuzol";"Suavizante";"1500 ml";"$1.590"
"140";"(Ref: 250282)";"Lider";"Prelavado con Gatillo Bolsa";"1 L";"$1.650"
"141";"(Ref: 613947)";"Soft";"Suavizante para la Ropa Soft Concentrado Piel sensible";"500 ml";"$1.950"
"142";"(Ref: 461037)";"Downy";"Suavizante Concentrado Citrus Botella";"3 L";"$1.990"
"143";"(Ref: 503178)";"Vanish";"Quitamanchas Líquido Doypack";"400 ml";"$2.050"
"144";"(Ref: 640289)";"Poett";"Perfumante de Telas Fraganza Love Evolution";"250 ml";"$2.050"
"145";"(Ref: 502520)";"Soft";"Suavizante para la Ropa Soft Concentrado Recarga";"450 ml";"$2.150"
"146";"(Ref: 264795)";"Lider";"Desmanchador Ropa Color";"1,8 L";"$2.290"
"147";"(Ref: 269136)";"Acuenta";"Bálsamo Suavizante de Ropa Bidón";"5 L";"$2.350"
"148";"(Ref: 561254)";"Rinso";"Detergente Líquido Matic Verde";"1 L";"$2.450"
"149";"(Ref: 260266)";"Clorox";"Lápiz de Cloro";"";"$2.790"
"150";"(Ref: 259624)";"Poett";"Perfumante de Telas Fraganza Sedoza Primavera Frasco";"450 ml";"$2.850"
"151";"(Ref: 627353)";"Vanish";"Quitamanchas polvo rosa doypack";"450 g";"$3.050"
"152";"(Ref: 627354)";"Vanish";"Quitamanchas polvo blanco doypack";"450 g";"$3.050"
"153";"(Ref: 498975)";"KH-7";"Quitamanchas Ropa Blanca y de Color, Botella Recarga.";"750 ml";"$3.150"
"154";"(Ref: 503179)";"Vanish";"Prelavado para Ropa White Botella";"500 ml";"$3.250"
"155";"(Ref: 542635)";"Clorox";"Cloro Ropa Blanca Poder Dual Botella";"4 L";"$3.750"
"156";"(Ref: 269211)";"Popeye";"Detergente Líquido Hipoalergénico Botella";"1 L";"$3.950"
"157";"(Ref: 394138)";"Fuzol";"Detergente Líquido Forte Doypack";"1,5 L";"$4.150"
"158";"(Ref: 320842)";"Omo";"Detergente en Polvo Hipoalergénico Piel Sensible";"1 Kg";"$4.690"
"159";"(Ref: 637346)";"Febreze";"Aromatizante de Telas Dormitorio";"800 ml";"$4.950"
"160";"(Ref: 507065)";"Downy";"Suavizante Ultra Infusions Lavander Serenity";"1230 ml";"$4.990"
"161";"(Ref: 671624)";"Vanish";"Quitamanchas Líquido Max";"3785 ml";"$6.490"
"162";"(Ref: 605756)";"Clorox";"Quita Manchas Ropa Color sin Cloro Doypack 900 g";"900 g";"$7.190"
"163";"(Ref: 605753)";"Clorox";"Quita Manchas Ropa Blanca sin Cloro Doypack 900 g";"900 g";"$7.190"
"164";"(Ref: 662352)";"Fuzol";"Detergente y Suavizante Recarga";"3000 ml";"$7.850"
"165";"(Ref: 399774)";"Drive";"Detergente Líquido Concentrado Recarga";"1 L";"$7.990"
"166";"(Ref: 693548)";"Ariel";"Detergente Líquido Concentrado Revitacolor";"1200 ml";"$8.250"
"167";"(Ref: 606707)";"Ariel";"Detergente Pods 16 Cápsulas";"368 g";"$8.650"
"168";"(Ref: 695730)";"Fuzol";"Detergente Pack Forte 2 Un x 3 Litros";"1 Un";"$9.990"
"169";"(Ref: 695729)";"Fuzol";"Detergente Pack Forte + Color Protect 2 Un x 3 Litros";"1 Un";"$9.990"
"170";"(Ref: 694975)";"Omo";"Detergente Líquido Piel Sensible Doypack";"2700 ml";"$10.190"
"171";"(Ref: 555050)";"Omo";"Detergente Líquido Progress Botella";"2,8 L";"$10.590"
"172";"(Ref: 694976)";"Omo";"Detergente Líquido Piel Sensible Botella";"2700 ml";"$11.290"
"173";"(Ref: 658125)";"Omo";"Detergente en polvo para Piel Sensible";"3000 g";"$11.790"
"174";"(Ref: 662455)";"Tide";"Detergente Tide Refreshing Breeze";"1770 ml";"$11.990"
"175";"(Ref: 662457)";"Tide";"Detergente Simply Daybreak Fresh";"1770 ml";"$11.990"
"176";"(Ref: 693549)";"Ariel";"Detergente Líquido Revitacolor";"2800 ml";"$16.590"
"177";"(Ref: 689200)";"Ariel";"Detergente en Polvo Downy";"9 Kg";"$16.990"
"178";"(Ref: 668809)";"Mainstays";"Basurero Cromado Gris";"1 Un";"$3.990"
"179";"(Ref: 668811)";"Mainstays";"Basurero Cromado Blanco";"1 Un";"$3.990"
"180";"(Ref: 668808)";"Mainstays";"Basurero Cromado Menta";"1 Un";"$3.990"
"181";"(Ref: 668810)";"Mainstays";"Basurero Cromado Rosa";"1 Un";"$3.990"
"182";"(Ref: 668812)";"Mainstays";"Basurero Cromado Azul";"1 Un";"$3.990"
"183";"(Ref: 269017)";"Acuenta";"Set Cepillo WC";"";"$2.290"
"184";"(Ref: 625900)";"Mr Musculo";"Pack Bloque para Estanque Inodoro";"2 Un";"$1.850"
"185";"(Ref: 539860)";"Haus";"Forro Cortina de Baño Blanco";"";"$1.490"
"186";"(Ref: 523882)";"Scotch-Brite";"Mopa Limpieza Para Ducha";"";"$6.590"
"187";"(Ref: 653197)";"Mainstays";"Pesa Digital";"1 Un";"$6.990"
"188";"(Ref: 653189)";"Haus";"Set 12 Ganchos De Cortina Plasticos";"1 Un";"$990"
"189";"(Ref: 653187)";"Haus";"Set 12 Ganchos De Cortina Metálicos ( Varios Colores)";"1 Un";"$1.490"
"190";"(Ref: 615643)";"Haus";"Forro Cortina de Baño Transparente 180 x 180 cm";"1 Un";"$1.490"
"191";"(Ref: 615641)";"Haus";"Forro Cortina de Baño Frosted 180 x 180 cm";"1 Un";"$1.490"
"192";"(Ref: 494802)";"Haus";"Toalla de Mano Amarilla";"";"$1.592"
"193";"(Ref: 494800)";"Haus";"Toalla de Mano Blanca";"";"$1.592"
"194";"(Ref: 491042)";"Haus";"Toalla de Mano Lima";"";"$1.592"
"195";"(Ref: 494801)";"Haus";"Toalla de Mano Porcelana";"";"$1.592"
"196";"(Ref: 585425)";"Haus";"Toalla Mano Morada";"";"$1.592"
"197";"(Ref: 585426)";"Haus";"Toalla Mano Turquesa";"";"$1.592"
"198";"(Ref: 491044)";"Haus";"Toalla de Mano Sandía";"";"$1.592"
"199";"(Ref: 264290)";"Acuenta";"Sopapo";"";"$1.890"
"200";"(Ref: 669854)";"Haus";"Piso Espuma ( Varios Colores)";"1 Un";"$1.990"
"201";"(Ref: 653195)";"Haus Kids";"Set 6 Antideslizante Kids";"1 Un";"$1.990"
"202";"(Ref: 269023)";"Acuenta";"Cepillo para WC";"";"$1.990"
"203";"(Ref: 673616)";"Haus Kids";"Set Baño Kids";"1 Un";"$1.990"
"204";"(Ref: 674602)";"Mainstays";"Dispensador Vidrio ( Diseños Surtidos)";"1 Un";"$1.990"
"205";"(Ref: 669853)";"Haus";"Set 6 Antideslizantes";"1 Un";"$1.990"
"206";"(Ref: 653196)";"Haus";"Basurero Plástico ( Varios Colores)";"1 Un";"$1.990"
"207";"(Ref: 669856)";"Mainstays";"Dispensador Vidrio";"1 Un";"$1.990"
"208";"(Ref: 653193)";"Haus";"Piso De Baño Antideslizante";"1 Un";"$1.990"
"209";"(Ref: 494805)";"Haus";"Toalla de Mano Ivory";"";"$1.990"
"210";"(Ref: 650320)";"Mainstays";"Toalla de Mano Spa Gris";"";"$2.990"
"211";"(Ref: 650332)";"Mainstays";"Toalla de Mano Zero Menta";"";"$2.990"
"212";"(Ref: 653188)";"Mainstays";"Set 12 Ganchos De Cortina Cerámica ( Varios Colores)";"1 Un";"$2.990"
"213";"(Ref: 650489)";"Haus";"Piso Baño Morado";"1 Un";"$2.990"
"214";"(Ref: 650318)";"Mainstays";"Toalla de Mano Spa Azul";"";"$2.990"
"215";"(Ref: 650484)";"Haus";"Piso Baño Ivory";"1 Un";"$2.990"
"216";"(Ref: 670426)";"Haus";"Cortina Peva ( Varios Diseños)";"1 Un";"$2.990"
"217";"(Ref: 650316)";"Mainstays";"Toalla de Mano Spa Rosa";"";"$2.990"
"218";"(Ref: 650319)";"Mainstays";"Toalla de Mano Spa Grafito";"";"$2.990"
"219";"(Ref: 669855)";"Haus Kids";"Piso Espuma Niños ( Varios Diseños)";"1 Un";"$2.990"
"220";"(Ref: 650490)";"Haus";"Piso Baño Turquesa";"1 Un";"$2.990"
"221";"(Ref: 650317)";"Mainstays";"Toalla de Mano Spa Blanca";"";"$2.990"
"222";"(Ref: 650481)";"Haus";"Piso Baño Azul";"1 Un";"$2.990"
"223";"(Ref: 650485)";"Haus";"Piso Baño Lima";"1 Un";"$2.990"
"224";"(Ref: 650488)";"Haus";"Piso Baño Gris";"1 Un";"$2.990"
"225";"(Ref: 650486)";"Haus";"Piso Baño Porcelana";"1 Un";"$2.990"
"226";"(Ref: 671776)";"Mainstays";"Piso de Baño Antideslizante ( Varios Colores)";"1 Un";"$2.990"
"227";"(Ref: 650483)";"Haus";"Piso Baño Blanco";"1 Un";"$2.990"
"228";"(Ref: 650315)";"Mainstays";"Toalla de Mano Spa Menta";"";"$2.990"
"229";"(Ref: 650330)";"Mainstays";"Toalla de Mano Zero Blanca";"";"$2.990"
"230";"(Ref: 670427)";"Haus Kids";"Cortina Peva Kids ( Varios Diseños)";"1 Un";"$2.990"
"231";"(Ref: 670224)";"Haus";"Set Baño Adulto ( Varios Colores)";"1 Un";"$2.990"
"232";"(Ref: 650331)";"Mainstays";"Toalla de Mano Zero Gris";"";"$2.990"
"233";"(Ref: 650487)";"Haus";"Piso Baño Sandia";"1 Un";"$2.990"
"234";"(Ref: 259151)";"Virutex";"Sopapo Baño Clásico";"";"$3.950"
"235";"(Ref: 668820)";"Mainstays";"Piso Pompom Spa Grafito";"1 Un";"$3.990"
"236";"(Ref: 668806)";"Mainstays";"Basurero Cromado Cobre";"1 Un";"$3.990"
"237";"(Ref: 668817)";"Mainstays";"Piso Pompom Spa Menta";"1 Un";"$3.990"
"238";"(Ref: 667058)";"Haus";"Set Cortina Peva + Ganchos( Varios Diseños)";"1 Un";"$3.990"
"239";"(Ref: 668816)";"Mainstays";"Piso Pompom Spa Blanco";"1 Un";"$3.990"
"240";"(Ref: 671775)";"Mainstays";"Dispensador Cobre";"1 Un";"$3.990"
"241";"(Ref: 668821)";"Mainstays";"Piso Pompom Spa Rosa";"1 Un";"$3.990"
"242";"(Ref: 668818)";"Mainstays";"Piso Pompom Spa Azul";"1 Un";"$3.990"
"243";"(Ref: 669519)";"Mainstays";"Basurero Cromado";"1 Un";"$3.990"
"244";"(Ref: 670228)";"Mainstays";"Set Cerámica Cobre";"1 Un";"$3.990"
"245";"(Ref: 670222)";"Mainstays";"Set Ceramica Blanco";"1 Un";"$3.990"
"246";"(Ref: 670223)";"Mainstays";"Set Baño Ceramica ( Varios Colores)";"1 Un";"$3.990"
"247";"(Ref: 668819)";"Mainstays";"Piso Pompom Spa Gris";"1 Un";"$3.990"
"248";"(Ref: 383847)";"Haus";"Basurero con Tapa 32 L RED";"";"$3.990"
"249";"(Ref: 585423)";"Haus";"Toalla Baño Gris";"1 Un";"$3.992"
"250";"(Ref: 491039)";"Haus";"Toalla de Baño Lima";"";"$3.992"
"251";"(Ref: 585421)";"Haus";"Toalla Baño Morada";"";"$3.992"
"252";"(Ref: 475516)";"Haus";"Toalla de Baño Amarilla";"";"$3.992"
"253";"(Ref: 475515)";"Haus";"Toalla de Baño Azul";"";"$3.992"
"254";"(Ref: 585422)";"Haus";"Toalla Baño Turquesa";"";"$3.992"
"255";"(Ref: 475517)";"Haus";"Toalla de Baño Blanca";"";"$3.992"
"256";"(Ref: 491040)";"Haus";"Toalla de Baño Sandía";"";"$3.992"
"257";"(Ref: 671773)";"Mainstays";"Set Vidrio Vintage";"1 Un";"$4.990"
"258";"(Ref: 670425)";"Mainstays";"Cortina Poliester ( Varios Diseños)";"1 Un";"$4.990"
"259";"(Ref: 544029)";"Kendy";"Papelero Pedal 10 Lts";"";"$4.990"
"260";"(Ref: 475521)";"Haus";"Toalla Baño Ivory";"";"$4.990"
"261";"(Ref: 585416)";"Haus";"Toalla Sabana Azul";"1 Un";"$5.592"
"262";"(Ref: 491049)";"Haus";"Toalla Sábana Lima";"";"$5.592"
"263";"(Ref: 475544)";"Haus";"Toalla Sábana Blanca";"";"$5.592"
"264";"(Ref: 475547)";"Haus";"Toalla Sábana Amarilla";"";"$5.592"
"265";"(Ref: 585418)";"Haus";"Toalla Sábana Turquesa";"";"$5.592"
"266";"(Ref: 585417)";"Haus";"Toalla Sábana Morada";"";"$5.592"
"267";"(Ref: 491051)";"Haus";"Toalla Sábana Sandía";"";"$5.592"
"268";"(Ref: 475545)";"Haus";"Toalla Sábana Porcelana";"";"$5.592"
"269";"(Ref: 650329)";"Mainstays";"Toalla de Baño Zero Menta";"";"$6.990"
"270";"(Ref: 475552)";"Haus";"Toalla Sabana Ivory";"";"$6.990"
"271";"(Ref: 650313)";"Mainstays";"Toalla de Baño Spa Grafito";"";"$6.990"
"272";"(Ref: 650310)";"Mainstays";"Toalla de Baño Spa Rosa";"";"$6.990"
"273";"(Ref: 650311)";"Mainstays";"Toalla de Baño Spa Blanca";"";"$6.990"
"274";"(Ref: 650328)";"Mainstays";"Toalla de Baño Zero Gris";"";"$6.990"
"275";"(Ref: 650327)";"Mainstays";"Toalla de Baño Zero Blanca";"";"$6.990"
"276";"(Ref: 650312)";"Mainstays";"Toalla de Baño Spa Azul";"";"$6.990"
"277";"(Ref: 650314)";"Mainstays";"Toalla de Baño Spa Gris";"";"$6.990"
"278";"(Ref: 650309)";"Mainstays";"Toalla de Baño Spa Menta";"";"$6.990"
"279";"(Ref: 543203)";"Rey Plast";"Papelera Automática";"19 L";"$7.990"
"280";"(Ref: 537832)";"Sterilite";"Basurero Tapa 28 Lts.";"";"$7.990"
"281";"(Ref: 650326)";"Mainstays";"Toalla Sabana Spa Grafito";"";"$8.990"
"282";"(Ref: 650321)";"Mainstays";"Toalla Sabana Spa Menta";"";"$8.990"
"283";"(Ref: 650335)";"Mainstays";"Toalla Sabana Zero Menta";"";"$8.990"
"284";"(Ref: 650322)";"Mainstays";"Toalla Sabana Spa Rosa";"";"$8.990"
"285";"(Ref: 650334)";"Mainstays";"Toalla Sabana Zero Gris";"";"$8.990"
"286";"(Ref: 650323)";"Mainstays";"Toalla Sabana Spa Gris";"";"$8.990"
"287";"(Ref: 650325)";"Mainstays";"Toalla Sabana Spa Azul";"";"$8.990"
"288";"(Ref: 650333)";"Mainstays";"Toalla Sabana Zero Blanca";"";"$8.990"
"289";"(Ref: 650324)";"Mainstays";"Toalla Sabana Spa Blanca";"";"$8.990"
"290";"(Ref: 537833)";"Sterilite";"Basurero Pedal Tapa 42 Lts";"";"$9.990"
"291";"(Ref: 607805)";"Better home";"Basurero 12 L Ova Acero";"";"$10.990"
"292";"(Ref: 619751)";"Better Homes";"Basurero Oval 12 Litros ( Colores Surtidos)";"1 Un";"$10.990"
"293";"(Ref: 533431)";"Better Homes";"Basurero Pedal 30 L";"1 Un";"$12.990"
"294";"(Ref: 607804)";"Better home";"Basurero 30L Red Acero";"";"$14.990"
"295";"(Ref: 236217)";"Wenco";"Basurero 125 Lts.";"";"$14.990"
"296";"(Ref: 243281)";"Arom";"Desodorante para Inodoros Jardín de Lavanda Caja";"40 g";"$570"
"297";"(Ref: 243200)";"Arom";"Desodorante para Inodoros Vainilla en Flor Caja";"40 g";"$570"
"298";"(Ref: 263912)";"Lider";"Cloro Limón Botella";"950 ml";"$650"
"299";"(Ref: 250311)";"Quix";"Lavaloza Concentrado Limón";"300 ml";"$650"
"300";"(Ref: 270498)";"Lider";"Cloro Botella";"1 L";"$730"
"301";"(Ref: 243642)";"Virginia";"Lavalozas Limón Citrus";"450 ml";"$740"
"302";"(Ref: 263924)";"Lider";"Cloro Aroma Lavanda Botella";"950 g";"$760"
"303";"(Ref: 420772)";"Lider";"Repuesto Limpiador Líquido Antigrasa Multi Superficie Doy Pack";"450 ml";"$770"
"304";"(Ref: 268967)";"Lider";"Cloro Concentrado Botella";"1 L";"$790"
"305";"(Ref: 583002)";"Glade";"Pastilla para Estanque Campos de Lavanda Caja";"25 g";"$850"
"306";"(Ref: 259005)";"Clorox";"Cloro Aroma Flores de Lavanda Botella";"950 g";"$940"
"307";"(Ref: 606716)";"Clorinda";"Cloro Aroma Lavanda Botella";"950 ml";"$950"
"308";"(Ref: 606718)";"Clorinda";"Cloro Aroma Limón Botella";"950 ml";"$950"
"309";"(Ref: 543956)";"Mr Musculo";"Limpiador Adhesivo Inodoro Lavanda Caja";"24 g";"$950"
"310";"(Ref: 557227)";"Haus";"Tazón Expresso";"1 Un";"$990"
"311";"(Ref: 264710)";"Lider";"Limpiador Crema Botella";"375 g";"$990"
"312";"(Ref: 468853)";"Haus";"Porta Toalla Nova";"1 Un";"$990"
"313";"(Ref: 557226)";"Haus";"Tazón Vidrio Té";"1 Un";"$990"
"314";"(Ref: 472458)";"Haus";"Espumadera Nylon";"";"$990"
"315";"(Ref: 499456)";"Haus";"Jarra Plástica con Tapa";"2 L";"$990"
"316";"(Ref: 649903)";"Cif";"Cif Active Gel Concentrado Limón Verde 300 ml";"300 ml";"$1.000"
"317";"(Ref: 420773)";"Lider";"Limpiador Antihongos Recarga Doypack";"500 ml";"$1.090"
"318";"(Ref: 582998)";"Arom";"Pastillas para Inodoros Jardín de Lavanda Caja";"3 Un";"$1.140"
"319";"(Ref: 263938)";"Lider";"Cloro Aroma Limón Botella";"1,9 L";"$1.190"
"320";"(Ref: 264718)";"Lider";"Limpiador Crema Limón Botella";"750 ml";"$1.190"
"321";"(Ref: 269123)";"Lider";"Lavalozas Limón Botella";"750 ml";"$1.190"
