"codigo";"Marca";"descripcion";"cantidad";"precio"
"322";"(Ref: 583005)";"Lysoform";"Discos Activos para Inodoro Lavanda Caja";"36 g";"$1.190"
"323";"(Ref: 543951)";"Mr Musculo";"Repuesto Limpiador Líquido Antigrasa Doypack";"500 ml";"$1.290"
"324";"(Ref: 445926)";"Clorox";"Limpiador Desinfectante Antihongos Recarga Botella";"500 cc";"$1.290"
"325";"(Ref: 691706)";"Clorox";"Toallas Desinfectantes Aroma Fresco";"15 Un";"$1.290"
"326";"(Ref: 270514)";"Lider";"Cloro Concentrado Botella";"2 L";"$1.290"
"327";"(Ref: 577259)";"Ilko";"Pinzas Plásticas para Ropa";"24 Un";"$1.290"
"328";"(Ref: 449198)";"Clorinda";"Cloro Gel Flores Silvestres Botella";"900 ml";"$1.350"
"329";"(Ref: 264517)";"Klaren";"Soda Cáustica Botella";"250 g";"$1.350"
"330";"(Ref: 555612)";"Cif";"Limpiador Crema Ultra Higiene";"375 g";"$1.350"
"331";"(Ref: 658083)";"KH-7";"Limpiador de Baño";"500 ml";"$1.390"
"332";"(Ref: 531940)";"Mr Musculo";"Limpiador en Crema Floral Botella";"450 ml";"$1.390"
"333";"(Ref: 531942)";"Mr Musculo";"Limpiador en Crema Mañana de Campo Botella";"450 ml";"$1.390"
"334";"(Ref: 264421)";"Lysoform";"Pastilla para estanque inodoro";"1 Un";"$1.450"
"335";"(Ref: 689289)";"Lysoform";"Canasta Activa Acción Continua (Pino)";"38,6 gr";"$1.490"
"336";"(Ref: 259012)";"Clorox";"Cloro Flores de Lavanda Botella";"1,9 L";"$1.490"
"337";"(Ref: 464850)";"Tempo";"Bowl Vidrio Chico 10";"7 cm";"$1.490"
"338";"(Ref: 253359)";"Luminarc";"Plato Entrada";"1 Un";"$1.490"
"339";"(Ref: 606719)";"Clorinda";"Cloro Aroma Limón Botella";"1.900 ml";"$1.550"
"340";"(Ref: 606717)";"Clorinda";"Cloro Aroma Lavanda Botella";"1.900 ml";"$1.550"
"341";"(Ref: 678392)";"Mr Musculo";"Antigrasa Extra Power Cocina (Repuesto)";"450 ml";"$1.590"
"342";"(Ref: 471845)";"Cif";"Limpiador Cocina Power Cream Recarga";"450 ml";"$1.650"
"343";"(Ref: 421520)";"Lider";"Limpia Vidrios Doypack";"900 ml";"$1.690"
"344";"(Ref: 623834)";"Lider";"Limpiador Baño Doypack";"900 ml";"$1.690"
"345";"(Ref: 691671)";"Dawn";"Lavalozas Blue";"479 ml";"$1.700"
"346";"(Ref: 269044)";"Lider";"Limpia Baño con Gatillo Botella";"500 ml";"$1.750"
"347";"(Ref: 269027)";"Lider";"Limpiador Líquido Antigrasa Cocina Gatillo Botella";"500 cc";"$1.750"
"348";"(Ref: 269069)";"Lider";"Limpia Vidrios Con Gatillo Botella";"500 ml";"$1.750"
"349";"(Ref: 658024)";"Lider";"Discos Activos Marina";"36 ml";"$1.750"
"350";"(Ref: 658022)";"Lider";"Discos Activos Campos de Lavanda";"36 ml";"$1.750"
"351";"(Ref: 689292)";"Mr Musculo";"Gel Limpiador Activo Lavanda";"500 ml";"$1.790"
"352";"(Ref: 535184)";"KH-7";"Limpiador Multiuso Baño Gatillo";"750 ml";"$1.790"
"353";"(Ref: 500420)";"Libbey";"Plato Cuadrado 20";"3 cm";"$1.790"
"354";"(Ref: 689293)";"Mr Musculo";"Gel Limpiador Activo Marina";"500 ml";"$1.790"
"355";"(Ref: 464847)";"Tempo";"Plato Cuadrado 15";"2 cm";"$1.790"
"356";"(Ref: 676206)";"Lysoform";"Gel Limpiador con Cloro y Lavandina";"450 ml";"$1.790"
"357";"(Ref: 464851)";"Tempo";"Bowl Vidrio Grande";"14 cm";"$1.790"
"358";"(Ref: 671606)";"Virutex";"Toalla de Limpieza Multiuso Naranja";"50 Un";"$1.890"
"359";"(Ref: 264290)";"Acuenta";"Sopapo";"";"$1.890"
"360";"(Ref: 600090)";"Magistral";"Lavalozas Líquido Ultra Aloe";"500 ml";"$1.890"
"361";"(Ref: 671605)";"Virutex";"Toalla de Limpieza Multiuso Fresh";"50 Un";"$1.890"
"362";"(Ref: 259071)";"Cer";"Filtro de Campana";"2 Un";"$1.940"
"363";"(Ref: 649899)";"Cif";"Cif Active Gel Concentrado Limón 500 ml";"500 ml";"$1.950"
"364";"(Ref: 520093)";"Clorox";"Cloro Gel Pureza Cítrica Botella";"1500 ml";"$1.950"
"365";"(Ref: 676201)";"Mr Musculo";"Antigrasa Extra Power Cocina (Espuma o Spray)";"500 ml";"$1.990"
"366";"(Ref: 269023)";"Acuenta";"Cepillo para WC";"";"$1.990"
"367";"(Ref: 691705)";"Clorox";"Toallas Desinfectantes Aroma Limón";"34 Un";"$1.990"
"368";"(Ref: 543960)";"Virutex";"Toallas Desengrasantes para Cocina Aroma Naranja Frasco";"35 Un";"$1.990"
"369";"(Ref: 481256)";"Clorinda";"Cloro Gel Original Botella";"1500 g";"$1.990"
"370";"(Ref: 468852)";"Haus";"Servilletero Metálico";"";"$1.990"
"371";"(Ref: 523911)";"Haus";"Molde para Pizza";"30 cm";"$1.990"
"372";"(Ref: 253376)";"Luminarc";"Plato para Sopa";"";"$1.990"
"373";"(Ref: 481257)";"Clorinda";"Cloro Gel Menta Caja";"1500 ml";"$1.990"
"374";"(Ref: 606715)";"Clorox";"Cloro Gel Lavanda Botella";"1500 ml";"$2.050"
"375";"(Ref: 254685)";"Lider";"Cloro Botella";"4 L";"$2.090"
"376";"(Ref: 691672)";"Dawn";"Lavalozas Blue";"709 ml";"$2.100"
"377";"(Ref: 460209)";"Harpic";"Limpiador de Sanitarios Acuático Azul 3 en 1 Display";"2 Un";"$2.150"
"378";"(Ref: 531950)";"Mr Musculo";"Limpiador Continuo para Inodoros Lavanda Caja";"36 ml";"$2.190"
"379";"(Ref: 689004)";"Cif";"Limpiador Cloro Gel Limón Botella";"1400 ml";"$2.190"
"380";"(Ref: 689003)";"Cif";"Limpiador Cloro Gel Normal Botella";"1400 ml";"$2.190"
"381";"(Ref: 583003)";"Lysoform";"Discos Activos para Inodoro Cítrico Caja";"38 g";"$2.290"
"382";"(Ref: 264611)";"Lider";"Limpia Vidrios Con Gatillo Botella";"1 L";"$2.290"
"383";"(Ref: 640240)";"Lysoform";"Pastillas para Estanque Inodoro";"2 Un";"$2.290"
"384";"(Ref: 561248)";"Lysol";"Toallas Húmeda Desinfectantes Ocean Fresh Pote";"35 Un";"$2.290"
"385";"(Ref: 649751)";"Seco";"Colgador Absorbedor De Humedad Aroma Lavanda";"220 g";"$2.390"
"386";"(Ref: 458421)";"Haus";"Bowl Colador Acero";"24 cm";"$2.489"
"387";"(Ref: 248773)";"Ilko";"Cuchara Lisa Nylon";"1 Un";"$2.490"
"388";"(Ref: 543948)";"Clorox";"Toalla Húmeda Desinfectante Orange Fusion Frasco";"35 Un";"$2.490"
"389";"(Ref: 265229)";"Ilko";"Abrelatas Multiple";"1 Un";"$2.490"
"390";"(Ref: 259226)";"Clorox";"Toalla Húmeda Desinfectante Limón Frasco";"35 Un";"$2.490"
"391";"(Ref: 447047)";"Haus";"Tabla De Cortar ( Varios Colores)";"1 Un";"$2.490"
"392";"(Ref: 268340)";"Ilko";"Cucharon Nylon";"1 Un";"$2.490"
"393";"(Ref: 260727)";"Virutex";"Sopapo Lavaplatos";"";"$2.550"
"394";"(Ref: 264109)";"Cif";"Limpiador Cocina Power Cream Gatillo";"500 cc";"$2.650"
"395";"(Ref: 464849)";"Tempo";"Plato Rectangular 24,1 x 12";"7 cm";"$2.690"
"396";"(Ref: 498836)";"Haus";"Panera Metálica Cromado";"";"$2.990"
"397";"(Ref: 499469)";"Haus";"Panera Metálica";"";"$2.990"
"398";"(Ref: 252170)";"Dura Pool";"Sube PH Granular";"1 Kg";"$2.990"
"399";"(Ref: 606146)";"Aquaevo";"Floculante Decantador";"1 Un";"$2.990"
"400";"(Ref: 252179)";"Dura Pool";"Baja PH Granular";"1 Kg";"$2.990"
"401";"(Ref: 614212)";"Dawn";"Lavalozas Ultra Cleans Aroma Original";"431 ml";"$3.090"
"402";"(Ref: 257104)";"Virginia";"Limpia Hornos Lata";"400 cc";"$3.290"
"403";"(Ref: 640242)";"Lysoform";"Pastilla para estanque inodoro";"4 Un";"$3.350"
"404";"(Ref: 394527)";"Haus";"Panquequera Alumino 24 cm (Varios Colores)";"1 Un";"$3.490"
"405";"(Ref: 415534)";"Mr Musculo";"Limpia Hornos Aerosol Lata";"356 cc";"$3.490"
"406";"(Ref: 539816)";"Haus";"Molde Redondo para Tarta";"";"$3.490"
"407";"(Ref: 270215)";"Haus";"Canasto para Huevos Diseño Gallina";"";"$3.490"
"408";"(Ref: 671607)";"Virutex";"Toalla de Limpieza Multiuso Limón";"90 Un";"$3.650"
"409";"(Ref: 649900)";"Cif";"Cif Active Gel Concentrado Limón 750 ml";"750 ml";"$3.690"
"410";"(Ref: 614211)";"Dawn";"Lavalozas Ultra Cleans Aroma Original";"638 ml";"$3.890"
"411";"(Ref: 259151)";"Virutex";"Sopapo Baño Clásico";"";"$3.950"
"412";"(Ref: 598136)";"Frio Fresh";"Filtro Purificador de Refrigeradores";"";"$3.990"
"413";"(Ref: 649901)";"Cif";"Cif Active Gel Concentrado Limón 900 ml";"900 ml";"$3.990"
"414";"(Ref: 446059)";"Haus";"Seca Platos con Bandeja y Escurridor";"";"$3.990"
"415";"(Ref: 543963)";"Klaren";"Destapa Cañerías Extra Power Líquido Botella";"1 L";"$4.190"
"416";"(Ref: 606144)";"Aquaevo";"Cloro Tableta";"1 Kg";"$4.290"
"417";"(Ref: 543949)";"Clorox";"Toalla Húmeda Desinfectante Orange Fusion Frasco";"75 Un";"$4.850"
"418";"(Ref: 666677)";"Finish";"Detergente en tabletas";"16 g";"$4.950"
"419";"(Ref: 269742)";"Ilko";"Decorador Torta";"1 Un";"$4.990"
"420";"(Ref: 541168)";"Mega";"Termo de Agua 0";"47 L";"$4.990"
"421";"(Ref: 464853)";"Tempo";"Ensaladera Cuadrada 22";"8 cm";"$5.290"
"422";"(Ref: 515546)";"Scotch-Brite";"Limpia Vidrios Pequeño";"";"$5.850"
"423";"(Ref: 265275)";"Ilko";"Sacacorcho Doble Palanca";"1 Un";"$5.990"
"424";"(Ref: 257559)";"Brasso";"Limpiador de Metales";"200 ml";"$6.090"
"425";"(Ref: 655651)";"Prepara";"Spray Citricos";"";"$6.990"
"426";"(Ref: 167814)";"Ilko";"Tostado Enlozado Ideal";"1 Un";"$6.990"
"427";"(Ref: 667606)";"Cascade";"Lavavajillas Gel Fresh";"2120 ml";"$7.090"
"428";"(Ref: 5648320)";"Cascade";"Capsulas lavavajillas Platinum Action Pacs Fresh";"284 g";"$7.690"
"429";"(Ref: 251654)";"Scotch-Brite";"Limpia vidrios con Mango";"1 Un";"$7.750"
"430";"(Ref: 543203)";"Rey Plast";"Papelera Automática";"19 L";"$7.990"
"431";"(Ref: 265879)";"Ilko";"Sartén 20 cm";"1 Un";"$8.990"
"432";"(Ref: 248761)";"Ilko";"Sartén 26 cm";"1 Un";"$11.990"
"433";"(Ref: 449049)";"Ilko";"Arrocera 24 cm";"1 Un";"$12.990"
"434";"(Ref: 248764)";"Ilko";"Sartén 30 cm";"1 Un";"$13.990"
"435";"(Ref: 699741)";"Cascade";"Detergente Lavajillas Platinum Actions 36 Cápsulas";"568 g";"$14.390"
"436";"(Ref: 647101)";"Virginia";"Trapero Húmedo Multiuso";"10 Un";"$1.990"
"437";"(Ref: 258575)";"Poett";"Limpiador Líquido Concentrado Lavanda Botella";"4 L";"$3.090"
"438";"(Ref: 460575)";"Lider";"Toallitas Húmedas Desinfectantes Limón Frasco";"35 Un";"$1.990"
"439";"(Ref: 460576)";"Lider";"Toallitas Húmedas Desinfectantes Fresh Frasco";"35 Un";"$1.990"
"440";"(Ref: 412128)";"Poett";"Limpiador de Pisos Líquido Espíritu Joven Botella";"4 L";"$3.090"
"441";"(Ref: 671529)";"Lider";"Trapero Humedo Desechable";"10 Un";"$1.990"
"442";"(Ref: 543969)";"Virginia";"Trapero Húmedo para Pisos Flotantes Lavanda Bolsa";"10 Un";"$2.090"
"443";"(Ref: 690124)";"Cif";"Toallitas de Limpieza Fresh";"35 Un";"$2.350"
"444";"(Ref: 690125)";"Cif";"Toallitas de Limpieza Limón";"35 Un";"$2.350"
"445";"(Ref: 259215)";"Clorox";"Toalla Húmeda Desinfectante Frasco";"35 Un";"$2.490"
"446";"(Ref: 441528)";"Nova";"Trapero Húmedo Desechable";"10 Un";"$2.590"
"447";"(Ref: 474749)";"Clorox";"Toallitas Húmedas Desinfectantes Fresh Frasco";"105 Un";"$5.750"
"448";"(Ref: 550162)";"Virutex";"Trapero Humedo Piso Flotante";"10 Un";"$2.090"
"449";"(Ref: 442441)";"Virutex";"Trapero Húmedo Desinfectante Bolsa";"10 Un";"$2.090"
"450";"(Ref: 495348)";"Clorox";"Toallitas Desinfectantes Mezcla Cítrica Frasco";"105 Un";"$5.750"
"451";"(Ref: 643477)";"Poett";"Limpiador Líquido Multiespacios Aroma Primavera";"4000 ml";"$4.250"
"452";"(Ref: 543662)";"Virginia";"Pack Limpiador + Abrillantador";"900 ml c/u";"$4.390"
"453";"(Ref: 496119)";"Clorox";"Toalla Húmeda Desinfectante Lavanda Frasco";"35 Un";"$2.550"
"454";"(Ref: 264263)";"Poett";"Limpiador de Pisos Líquido Aroma Lavanda Botella";"1,8 L";"$2.190"
"455";"(Ref: 259467)";"Excell";"Limpiador + Abrillantador 900 cc c/u";"2 Un";"$4.950"
"456";"(Ref: 289777)";"Virutex";"Paños Desinfectantes Desechables Limón Bolsa";"50 Un";"$2.350"
"457";"(Ref: 399591)";"Lysol";"Limpiador Líquido Manzana Botella";"1,8 L";"$1.890"
"458";"(Ref: 257125)";"Lysol";"Limpiador de Pisos Líquido Fragancia Marina Botella";"1,8 L";"$1.890"
"459";"(Ref: 270297)";"Acuenta";"Limpiador para Pisos Aroma Lavanda Botella";"5 L";"$2.930"
"460";"(Ref: 257681)";"Virginia";"Abrillantador Piso Flotante Botella";"900 cc";"$3.790"
"461";"(Ref: 550161)";"Virutex";"Trapero Húmedo Multiuso para Pisos Lavanda Bolsa";"10 Un";"$2.490"
"462";"(Ref: 689202)";"Poett";"Limpiador Líquido Multiespacios Aroma Primavera";"1800 ml";"$2.190"
"463";"(Ref: 534516)";"Blem";"Lustramuebles Aerosol Original Lata";"420 ml";"$2.290"
"464";"(Ref: 593896)";"Virginia";"Limpiador Piso Flotante y Laminados Almendra";"900 ml";"$1.950"
"465";"(Ref: 387045)";"Virginia";"Lustra Muebles Tradicional Botella";"500 cc";"$2.190"
"466";"(Ref: 257137)";"Lysol";"Limpiador de Pisos Líquido Aroma Lavanda Botella";"1,8 L";"$1.890"
"467";"(Ref: 387039)";"Virginia";"Cera Autobrillo Incolora Botella";"900 ml";"$1.990"
"468";"(Ref: 546797)";"Virginia";"Lustramuebles Aerosol Naranja Lata";"360 ml";"$1.990"
"469";"(Ref: 260865)";"Excell";"Abrillantador Piso Flotante Botella";"900 cc";"$3.590"
"470";"(Ref: 443418)";"Virginia";"Lustra Muebles Tradicional Aroma Lavanda Botella";"500 cc";"$2.190"
"471";"(Ref: 600082)";"Virutex";"Limpia Piso Aroma Primavera Botella";"1800 ml";"$1.690"
"472";"(Ref: 443398)";"Virginia";"Lustra Muebles Tradicional Frasco";"250 cc";"$1.250"
"473";"(Ref: 258852)";"Clorox";"Toalla Húmeda Desinfectante Fresh Frasco";"75 Un";"$4.850"
"474";"(Ref: 505780)";"Alex";"Cera Renovadora Directo al Piso Botella";"1 L";"$5.190"
"475";"(Ref: 515106)";"Mr Musculo";"Limpiador Desinfectante Lavanda Botella 4 L";"4 L";"$3.990"
"476";"(Ref: 505781)";"Alex";"Limpiador de Pisos de Madera Aroma Naranja Botella";"1 L";"$2.090"
"477";"(Ref: 534513)";"Blem";"Lustra Muebles Aerosol Aroma Naranja Lata";"360 ml";"$2.290"
"478";"(Ref: 258336)";"Poett";"Limpiador de Pisos Líquido Espíritu Joven Botella";"1,8 L";"$2.190"
"479";"(Ref: 645866)";"Lysol";"Limpia Pisos Flores de Jardín";"1800 ml";"$1.890"
"480";"(Ref: 263317)";"Virginia";"Lustramuebles Aerosol Lavanda Lata";"360 cc";"$1.990"
"481";"(Ref: 515110)";"Mr Musculo";"Limpiador Desinfectante Glade Floral Perfection";"4 L";"$3.990"
"482";"(Ref: 543721)";"Virginia";"Limpiador de Piso Flotante Paso 1 Frutos Rojos Botella";"900 ml";"$1.950"
"483";"(Ref: 264215)";"Poett";"Limpiador Líquido Concentrado Aroma Lavanda Botella";"900 cc";"$1.250"
"484";"(Ref: 289776)";"Virutex";"Toallas Húmedas Multiuso Limón Frasco";"35 Un";"$1.990"
"485";"(Ref: 646816)";"Rinso";"Limpia Pisos Lavanda";"1800 ml";"$1.990"
"486";"(Ref: 549614)";"Excell";"Limpiador Piso Flotante Desinfectante Bebé Botella";"900 cc";"$2.850"
"487";"(Ref: 505773)";"Excell";"Abrillantador de Pisos Flotantes Botella";"1800 ml";"$7.350"
"488";"(Ref: 261581)";"Acuenta";"Limpiador para Pisos Aroma Floral Botella";"5 L";"$2.930"
"489";"(Ref: 267198)";"Scotch-Gard";"Protector Aerosol para Telas y Tapices Frasco";"496 g";"$10.800"
"490";"(Ref: 520971)";"Virutex";"Toallas Desinfectantes Baño Fresh Frasco";"35 Un";"$1.990"
"491";"(Ref: 505775)";"Excell";"Limpiador Piso Flotante Paso 1) Chocolate Vainilla Botella";"1800 ml";"$4.590"
"492";"(Ref: 648895)";"Excell";"Trapero Húmedo Piso Flotante Lavanda";"12 Un";"$2.290"
"493";"(Ref: 594676)";"Alex";"Cera Autobrillante Cuidado Extra";"750 ml";"$5.150"
"494";"(Ref: 600083)";"Virutex";"Limpia Piso Aroma Lavanda Botella";"1800 ml";"$2.150"
"495";"(Ref: 270338)";"Lider";"Lustra Muebles Tradicional Botella";"500 cc";"$1.750"
"496";"(Ref: 260160)";"Lysoform";"Limpiador de Pisos Líquido Desinfectante Doypack";"800 cc";"$1.590"
"497";"(Ref: 260871)";"Excell";"Removedor de Abrillantador de Piso Flotante";"900 ml";"$3.290"
"498";"(Ref: 253377)";"Alex";"Cera para Pisos de Madera Perfumada Botella";"750 ml";"$5.150"
"499";"(Ref: 630803)";"Virginia";"Limpiador + Abrillantador Lavanda";"900 ml";"$3.290"
"500";"(Ref: 263404)";"Virginia";"Lustramuebles Aceite de Naranja Botella";"260 ml";"$1.990"
"501";"(Ref: 242657)";"Virginia";"Cera Autobrillo Roja Virginia Botella";"900 ml";"$1.990"
"502";"(Ref: 260876)";"Excell";"Virutilla Líquida Pisos de Madera Botella";"900 cc";"$3.350"
"503";"(Ref: 264251)";"Acuenta";"Limpiador para Pisos Aroma Lavanda Botella";"2 L";"$1.170"
"504";"(Ref: 254236)";"Alex";"Abrillantador de Pisos Madera con Jabón de Coco Botella";"750 ml";"$3.790"
"505";"(Ref: 257488)";"Lysol";"Desinfectante Líquido Variedad Marina Botella";"900 ml";"$1.250"
"506";"(Ref: 561247)";"Lysol";"Toallas Húmeda Desinfectantes Lemon Pote";"35 Un";"$2.290"
"507";"(Ref: 257675)";"Virginia";"Limpiador Líquido Piso Flotante Botella";"900 cc";"$2.490"
"508";"(Ref: 600078)";"Virutex";"Limpia Piso Aroma Primavera Botella";"900 ml";"$1.250"
"509";"(Ref: 412953)";"Brillina";"Cera Crema Incolora Doy Pack";"360 cc";"$1.090"
"510";"(Ref: 297653)";"Excell";"Limpiador Piso Flotante Paso 1) Chocolate Vainilla Botella";"900 ml";"$2.850"
"511";"(Ref: 645865)";"Lysol";"Limpia Pisos Flores de Jardín";"900 ml";"$1.250"
"512";"(Ref: 651433)";"Excell";"Limpiador + Abrillantador Piso Flotante Flor de Cerezo";"900 ml";"$3.250"
"513";"(Ref: 257148)";"Lysol";"Limpiador Líquido Desinfectante Limón Botella";"1,8 ml";"$1.890"
"514";"(Ref: 257497)";"Lysol";"Limpiador Desinfectante Aroma Lavanda Botella";"900 ml";"$1.250"
"515";"(Ref: 264140)";"Acuenta";"Cera Líquida Incolora Botella";"2 L";"$1.430"
"516";"(Ref: 639197)";"Cif";"Limpia Piso Lavanda";"750 ml";"$1.350"
"517";"(Ref: 600085)";"Virutex";"Limpia Piso Aroma Cítrico Botella";"1800 ml";"$1.690"
"518";"(Ref: 639195)";"Cif";"Limpia Piso Jazmin";"750 ml";"$1.350"
"519";"(Ref: 594065)";"Lysol";"Limpiador Líquido Desinfectante Limón Botella";"5 L";"$5.350"
"520";"(Ref: 594063)";"Lysol";"Limpiador Líquido Desinfectante Lavanda Botella";"5 L";"$5.350"
"521";"(Ref: 260392)";"Mr Musculo";"Limpiador Piso Desinfectante Campos de Lavanda Botella";"900 ml";"$1.190"
"522";"(Ref: 259066)";"Poett";"Limpiador Líquido Dulces Momentos Botella";"900 ml";"$1.250"
"523";"(Ref: 600079)";"Virutex";"Limpia Piso Aroma Lavanda Botella";"900 ml";"$1.250"
"524";"(Ref: 391064)";"Virginia";"Lustra Muebles Vainilla Botella";"250 cc";"$1.250"
"525";"(Ref: 269055)";"Lider";"Lustra Muebles Tradicional Botella";"250 cc";"$900"
"526";"(Ref: 646815)";"Rinso";"Limpia Pisos Rosa";"1800 ml";"$1.990"
"527";"(Ref: 527441)";"Brillina";"Cera Crema Amarilla Brillina Bolsa";"360 g";"$1.090"
"528";"(Ref: 544313)";"Clorox";"Toalla Húmeda Desinfectante Frasco";"75 Un";"$4.850"
"529";"(Ref: 259096)";"Poett";"Limpiador Líquido Espíritu Joven Botella";"900 ml";"$1.250"
"530";"(Ref: 594064)";"Lysol";"Limpiador Líquido Desinfectante Marina Botella";"5 L";"$5.350"
"531";"(Ref: 268987)";"Lider";"Limpiador Amoniacloro Tradicional Botella";"1 L";"$1.250"
"532";"(Ref: 264152)";"Acuenta";"Cera Líquida Roja Botella";"2 L";"$1.430"
"533";"(Ref: 264058)";"Acuenta";"Cera Crema Incolora Display";"300 cc";"$450"
"534";"(Ref: 264035)";"Acuenta";"Cera Crema Caoba";"300 ml";"$450"
"535";"(Ref: 264046)";"Acuenta";"Cera Crema Natural Display";"300 cc";"$460"
"536";"(Ref: 264069)";"Acuenta";"Cera Crema Tierra de Color Display";"300 cc";"$470"
"537";"(Ref: 261609)";"Lider";"Virutilla Fina Para Pisos Mediana";"";"$580"
"538";"(Ref: 670376)";"Lider";"Cera Líquida Autobrillo Roja";"450 ml";"$790"
"539";"(Ref: 670375)";"Lider";"Cera Líquida Autobrillo Incolora";"450 ml";"$790"
"540";"(Ref: 261611)";"Lider";"Virutilla Gruesa Mediana";"";"$900"
"541";"(Ref: 264487)";"Lider";"Lustra Muebles No Deja Aureolas Botella";"250 ml";"$950"
"542";"(Ref: 264496)";"Lider";"Lustra Muebles Lavanda Botella";"250 ml";"$950"
"543";"(Ref: 543649)";"Lider";"Limpia Pisos Primavera Botella";"900 ml";"$950"
"544";"(Ref: 543652)";"Lider";"Limpia Pisos Bebé Botella";"900 ml";"$950"
"545";"(Ref: 543648)";"Lider";"Limpia Piso Lavanda";"900 ml";"$950"
"546";"(Ref: 639196)";"Cif";"Recarga Limpia Piso Lavanda";"450 ml";"$990"
"547";"(Ref: 639198)";"Cif";"Recarga Limpia Piso Jazmin";"450 ml";"$990"
"548";"(Ref: 312620)";"Virginia";"Cera Líquida Autobrillo Roja Doy Pack";"400 ml";"$1.050"
"549";"(Ref: 387034)";"Virginia";"Cera Líquida Autobrillo Incolora Doy Pack";"400 ml";"$1.060"
"550";"(Ref: 527442)";"Brillina";"Cera Crema Roja Brillina Bolsa";"360 g";"$1.090"
"551";"(Ref: 527443)";"Brillina";"Cera Crema con Tierra de Color Brillina Bolsa";"360 g";"$1.090"
"552";"(Ref: 247817)";"Lider";"Virutilla Gruesa";"";"$1.150"
"553";"(Ref: 264291)";"Acuenta";"Limpiador para Pisos Aroma Floral Botella";"2 L";"$1.170"
"554";"(Ref: 260383)";"Mr Musculo";"Limpiador Desinfectante Floral Perfection Botella";"900 ml";"$1.190"
"555";"(Ref: 646812)";"Rinso";"Limpia Pisos Rosa";"900 ml";"$1.250"
"556";"(Ref: 405368)";"Virginia";"Lustra muebles lavanda Virginia Frasco";"250 ml";"$1.250"
"557";"(Ref: 264226)";"Poett";"Limpiador Líquido Bebé Botella";"900 ml";"$1.250"
"558";"(Ref: 600081)";"Virutex";"Limpia Piso Aroma Cítrico Botella";"900 ml";"$1.250"
"559";"(Ref: 646813)";"Rinso";"Limpia Pisos Lavanda";"900 ml";"$1.250"
"560";"(Ref: 257504)";"Lysol";"Limpiador de Pisos Desinfectante Limón Botella";"900 cc";"$1.250"
"561";"(Ref: 542515)";"Poett";"Limpiador Líquido Multiespacios Aroma Primavera";"900 ml";"$1.250"
"562";"(Ref: 646814)";"Rinso";"Limpia Pisos Lilas";"900 ml";"$1.250"
"563";"(Ref: 689630)";"Poett";"Limp Piso Musica Primavera 900 ml";"900 ml";"$1.250"
"564";"(Ref: 420087)";"Lysol";"Limpiador Desinfectante Manzana Canela Botella";"900 ml";"$1.250"
"565";"(Ref: 534518)";"Blem";"Lustramuebles en Crema Original Botella";"200 ml";"$1.290"
"566";"(Ref: 691706)";"Clorox";"Toallas Desinfectantes Aroma Fresco";"15 Un";"$1.290"
"567";"(Ref: 534509)";"Blem";"Lustramuebles en Crema Lavanda";"200 ml";"$1.290"
"568";"(Ref: 665042)";"Lider";"Virutilla Fina Mediana (2 Un)";"1 Un";"$1.350"
"569";"(Ref: 505776)";"Brillina";"Cera Crema Extra Brillo Brillina Roja Bolsa";"530 ml";"$1.390"
"570";"(Ref: 505777)";"Brillina";"Cera Crema Amarilla Brillina Bolsa";"530 g";"$1.390"
"571";"(Ref: 505779)";"Brillina";"Cera Crema Extra Brillo Brillina Incolora Bolsa";"530 ml";"$1.390"
"572";"(Ref: 505778)";"Brillina";"Cera Crema Tierra de Color Brillina Bolsa";"530 cc";"$1.390"
"573";"(Ref: 250229)";"Lider";"Cera Incolora Auto Brillo Botella";"900 ml";"$1.520"
"574";"(Ref: 250237)";"Lider";"Cera Auto Brillo Roja Botella";"900 ml";"$1.520"
"575";"(Ref: 563978)";"Glade";"Limpiador para Pisos Paraíso Azul Botella";"1,8 L";"$1.650"
"576";"(Ref: 514836)";"Glade";"Limpiador Desinfectante Floral Perfection Botella";"1,8 L";"$1.650"
"577";"(Ref: 514834)";"Glade";"Limpiador Piso Desinfectante Campos de Lavanda Botella";"1,8 L";"$1.650"
"578";"(Ref: 660644)";"Virutex";"Limpia Pisos Aroma Vitalidad";"1800 ml";"$1.690"
"579";"(Ref: 542422)";"Lider";"Removedor de Ceras Botella";"900 ml";"$1.750"
"580";"(Ref: 671606)";"Virutex";"Toalla de Limpieza Multiuso Naranja";"50 Un";"$1.890"
"581";"(Ref: 264164)";"Lider";"Limpiador piso flotante Lider Botella";"900 cc";"$1.890"
"582";"(Ref: 671605)";"Virutex";"Toalla de Limpieza Multiuso Fresh";"50 Un";"$1.890"
"583";"(Ref: 691705)";"Clorox";"Toallas Desinfectantes Aroma Limón";"34 Un";"$1.990"
"584";"(Ref: 543960)";"Virutex";"Toallas Desengrasantes para Cocina Aroma Naranja Frasco";"35 Un";"$1.990"
"585";"(Ref: 546796)";"Virginia";"Lustramuebles Aerosol Vainilla Lata";"360 ml";"$1.990"
"586";"(Ref: 250245)";"Vervisa";"Desmanchador de Alfombras en Seco Pote";"350 g";"$1.990"
"587";"(Ref: 646817)";"Rinso";"Limpia Pisos Lilas";"1800 ml";"$1.990"
"588";"(Ref: 598262)";"Virutex";"Virutilla de Piso Madera sin Vitrificar Grande Display";"1 Un";"$2.150"
"589";"(Ref: 626832)";"Poett";"Limpiador De Piso Aroma Love Evolution";"1800 ml";"$2.190"
"590";"(Ref: 420876)";"Poett";"Limpiador Líquido Sólo para Ti Botella";"1800 ml";"$2.190"
"591";"(Ref: 255147)";"Ceraflot";"Cera para Pisos Flotante Botella";"1 L";"$2.210"
"592";"(Ref: 561248)";"Lysol";"Toallas Húmeda Desinfectantes Ocean Fresh Pote";"35 Un";"$2.290"
"593";"(Ref: 543948)";"Clorox";"Toalla Húmeda Desinfectante Orange Fusion Frasco";"35 Un";"$2.490"
"594";"(Ref: 259226)";"Clorox";"Toalla Húmeda Desinfectante Limón Frasco";"35 Un";"$2.490"
"595";"(Ref: 244861)";"Alex";"Rociador Directo al Piso con Aloe Vera Botella";"1 L";"$2.550"
"596";"(Ref: 535182)";"KH-7";"Multiusos Madera, Botella con Gatillo";"750 ml";"$2.690"
"597";"(Ref: 250244)";"Lider";"Abrillantador Piso Flotante Aroma Lavanda";"900 ml";"$3.150"
"598";"(Ref: 651879)";"Brillex";"Shampoo Para Alfombras";"900 cc";"$3.250"
"599";"(Ref: 671607)";"Virutex";"Toalla de Limpieza Multiuso Limón";"90 Un";"$3.650"
"600";"(Ref: 543720)";"Virginia";"Abrillantador de Piso Flotante Paso 2 Frutos Rojos Botella";"900 ml";"$3.790"
"601";"(Ref: 593897)";"Virginia";"Abrillantador Pisos Flotantes y Laminados Almendra";"900 ml";"$3.790"
"602";"(Ref: 651881)";"Great Value";"Limpiador de Alfombra Spray";"623 cc";"$3.990"
"603";"(Ref: 689632)";"Poett";"Limpiador Líquido Multiespacios Aroma Bebé";"4000 ml";"$4.250"
"604";"(Ref: 297652)";"Excell";"Abrillantador Paso 2 Piso Flotante Aroma Chocolate Vainilla Botella";"900 cc";"$4.290"
"605";"(Ref: 522955)";"Alex";"Limpiador Atrapa Polvo Parquet Lata";"600 ml";"$4.790"
"606";"(Ref: 543949)";"Clorox";"Toalla Húmeda Desinfectante Orange Fusion Frasco";"75 Un";"$4.850"
"607";"(Ref: 257539)";"Vanish";"Líquido Removedor Manchas de Alfombras y Tapicerías";"650 cc";"$5.390"
"608";"(Ref: 489004)";"Virginia";"Abrillantador Pisos Flotantes Lavanda Botella";"1800 ml";"$6.090"
"609";"(Ref: 505772)";"Excell";"Abrillantador Piso Flotante Paso 2) Lavanda Fresca Botella";"1800 ml";"$7.350"
"610";"(Ref: 270897)";"Elite";"Papel Higiénico Doble Hoja 30 m Paquete";"18 Rollos";"$9.590"
"611";"(Ref: 269439)";"Nova";"Toalla de Papel Ultra Megarollo Doble Hoja Paquete";"2 Rollos";"$1.950"
"612";"(Ref: 669554)";"Confort";"Papel Higiénico Doble Hoja 27 Metros";"24 Un";"$5.990"
"613";"(Ref: 630547)";"Lider";"Toalla Papel Super Megarrollo 32 Metros";"2 un";"$2.190"
"614";"(Ref: 270626)";"Scott";"Papel Higiénico Rindemax 30 m Paquete";"16 Rollos";"$4.850"
"615";"(Ref: 401283)";"Confort";"Papel Higiénico Doble Hoja 30 Metros c/u Paquete";"18 Un";"$8.490"
"616";"(Ref: 595310)";"Elite";"Papel Higiénico Elite Ultra Doble Hoja 12 un 50 mt";"12 Un";"$7.290"
"617";"(Ref: 269508)";"Confort";"Papel Higiénico Max Una Hoja 100 m Paquete";"8 Rollos";"$7.950"
"618";"(Ref: 472252)";"Confort";"Papel Higiénico Doble Hoja 50 Metros c/u Paquete";"12 Un";"$6.390"
"619";"(Ref: 269419)";"Nova";"Toalla de Papel Nova Clásica Doble Hoja 3 unidades 12,5 metros";"3 Rollos";"$1.710"
"620";"(Ref: 508078)";"Nova";"Toalla de Papel Nova Clásica Doble Hoja 12 unidades 12,5 metros";"12 Rollos";"$3.950"
"621";"(Ref: 270777)";"Scott";"Papel Higiénico Supreme Doble Hoja Paquete";"8 Rollos";"$3.490"
"622";"(Ref: 646147)";"Lider";"Papel Higiénico Doble Hoja Superior 30 Metros c/u Bolsa";"16 Un";"$7.350"
