"codigo";"Marca";"descripcion";"cantidad";"precio"
"292";"(Ref: 625728)";"Pedigree";"Alimento Perro Vital Adulto Carne y Vegetales Bolsa";"3 Kg";"$7.790"
"293";"(Ref: 548289)";"Petfy";"Collar con QR - Grande";"1 Un";"$7.990"
"294";"(Ref: 257734)";"Drag Pharma";"Pipeta Antiparasitario Externo";"1 Un";"$7.990"
"295";"(Ref: 613416)";"Dog Chow";"Alimento Seco Perros Adultos Mayores 7 Años";"3 Kg";"$8.250"
"296";"(Ref: 519199)";"Dog Chow";"Alimento Seco Adulto";"3 Kg";"$8.290"
"297";"(Ref: 687696)";"Dog Chow";"Alimento Perro Adulto Razas Medianas y Grandes con Pollo y Pavo";"3 Kg";"$8.390"
"298";"(Ref: 687695)";"Dog Chow";"Alimento Perro Adulto Razas Minis y Pequeñas con Pollo y Pavo";"3 Kg";"$8.550"
"299";"(Ref: 544654)";"Dog Chow";"Alimento Cachorro Raza Mediana y Grande";"3 Kg";"$8.590"
"300";"(Ref: 689530)";"Natures Miracle";"Removedor de Manchas y Olores - Perros";"709 cc";"$8.890"
"301";"(Ref: 613526)";"Dog Chow";"Alimento para perros";"3 Kg";"$8.950"
"302";"(Ref: 519196)";"Dog Chow";"Alimento Seco Cachorro";"3 Kg";"$9.390"
"303";"(Ref: 618976)";"Buddy Pet";"Cama de Invierno para Perros Tamaño XS";"";"$9.990"
"304";"(Ref: 618964)";"Buddy Pet";"Cama Plana de Invierno para Perros Tamaño XS";"";"$9.990"
"305";"(Ref: 257743)";"Drag Pharma";"Pipeta antiparasitaria - Fiprodrag";"1,34 ml";"$9.990"
"306";"(Ref: 687699)";"Sabro Kan";"Alimento Perro Adulto Carne y Arroz Bolsa";"15 Kg";"$11.290"
"307";"(Ref: 628675)";"Cannes";"Alimento Seco Premium Carne, Pollo y Cereales Razas Pequeñas 8 Kg";"8 Kg";"$12.590"
"308";"(Ref: 628674)";"Cannes";"Alimento Seco Senior 8 Kg";"8 Kg";"$12.590"
"309";"(Ref: 257709)";"Fiprokill";"Antiparasitario en Spray Externo para Perros y Gatos Botella";"100 ml";"$13.750"
"310";"(Ref: 561025)";"Master Dog";"Alimento Perro Senior +7 Años Carne Bolsa";"8 Kg";"$13.990"
"311";"(Ref: 236320)";"Drag Pharma";"Pipeta Perro - Fiprokill";"1 Un";"$13.990"
"312";"(Ref: 311077)";"Master Dog";"Alimento Cachorro Leche";"8 Kg";"$14.190"
"313";"(Ref: 618965)";"Buddy Pet";"Cama Plana de Invierno para Perros Tamaño M";"";"$14.990"
"314";"(Ref: 509925)";"Cannes";"Alimento Perro Cachorro Carne y Leche Bolsa";"8 Kg";"$14.990"
"315";"(Ref: 236326)";"Drag Pharma";"Fiprodrag Perros Pomo";"4,02 ml";"$15.150"
"316";"(Ref: 888959)";"Guau Forte";"Alimento Completo para Perros Adultos";"25 kg";"$15.290"
"317";"(Ref: 313327)";"Cachupin";"Alimento para Perros Adultos Sabor Pollo y Arroz Bolsa";"18 Kg";"$15.990"
"318";"(Ref: 656260)";"Bionic";"Alimento Perro Cachorro Sabor Carne";"15 Kg";"$16.950"
"319";"(Ref: 618966)";"Buddy Pet";"Cama Plana de Invierno para Perros Tamaño L";"";"$17.990"
"320";"(Ref: 319040)";"Pedigree";"Alimento Seco Carne Pollo y Leche para Perro Cachorro";"9 Kg";"$19.150"
"321";"(Ref: 656256)";"Bionic";"Alimento Perro Adulto Sabor Pollo";"15 Kg";"$19.650"
"322";"(Ref: 236858)";"Master Dog";"Alimento Cachorro Leche";"15 Kg";"$19.990"
"323";"(Ref: 687697)";"Dog Chow";"Alimento Perro Adulto Razas Medianas y Grandes con Pollo y Pavo";"15 Kg";"$23.990"
"324";"(Ref: 639623)";"Master Dog";"Alimento Premium para Perros Adultos Sabor Carne";"21 kg";"$26.390"
"325";"(Ref: 687698)";"Dog Chow";"Alimento Perro Adulto todos los tamaños - Control de peso";"15 Kg";"$30.050"
"326";"(Ref: 607922)";"Dog Chow";"Alimento Perro Adulto Razas Medianas y Grandes Vida Sana";"21 Kg";"$37.990"
"327";"(Ref: 584522)";"Cat Chow";"Alimento Seco para Gato Adulto Delimix";"8 Kg";"$19.990"
"328";"(Ref: 267567)";"Tidy Cats";"Arena Sanitaria para Gatos 24/7 Performance Bolsa";"9 Kg";"$9.850"
"329";"(Ref: 509598)";"Cat Chow";"Alimento Seco para Gato Adulto Carne";"8 Kg";"$18.990"
"330";"(Ref: 444794)";"Loops";"Arena Sanitaria para Gatos Biodegradable Bolsa";"4,5 Kg";"$3.990"
"331";"(Ref: 296809)";"Drag Pharma";"Arena Sanitaria Crystal Clear Litter Pearls para Gatos";"3,1 Kg";"$8.290"
"332";"(Ref: 236621)";"Master Cat";"Alimento Seco Salmón y Sardinas para Gato Bolsa";"3 Kg";"$6.290"
"333";"(Ref: 255151)";"Whiskas";"Alimento Seco para Gatos Adultos Sabor Carne Bolsa";"3 Kg";"$7.150"
"334";"(Ref: 509609)";"Cat Chow";"Alimento Seco para Gatitos De 1 a 12 Meses";"1 Kg";"$3.990"
"335";"(Ref: 660804)";"Champion Cat";"Arena Sanitaria Premium";"5 Kg";"$4.390"
"336";"(Ref: 655497)";"Fresh Step";"Arena Para Gatos Aglometante";"6.4 Kg";"$14.390"
"337";"(Ref: 584521)";"Cat Chow";"Alimento Gato Adulto Deli Mix Bolsa";"3 Kg";"$10.050"
"338";"(Ref: 268680)";"Champion Cat";"Alimento Seco para Gatos de Sabores Del Mar Bolsa";"8 Kg";"$13.950"
"339";"(Ref: 504999)";"Gati";"Alimento Seco para Gato Arroz y Espinaca";"8 Kg";"$14.350"
"340";"(Ref: 265973)";"Champion Cat";"Alimento Seco para Gato Sabor Original Bolsa";"8 Kg";"$13.950"
"341";"(Ref: 509596)";"Cat Chow";"Alimento Seco para Gato Adulto Carne";"1 Kg";"$3.790"
"342";"(Ref: 251635)";"Purina";"Arena para Gatos 24/7 Performance";"4,54 Kg";"$5.190"
"343";"(Ref: 660803)";"Champion Cat";"Arena Sanitaria Premium Aglomerada";"5 Kg";"$6.290"
"344";"(Ref: 608973)";"Cat Chow";"Alimento Seco Gato Peso Saludable Bolsa";"8 Kg";"$22.290"
"345";"(Ref: 526139)";"Acuenta";"Arena Sanitaria para Gatos Bolsa";"4 Kg";"$2.890"
"346";"(Ref: 236672)";"Master Cat";"Alimento Seco Sabor Carne para Gato Bolsa";"8 Kg";"$17.590"
"347";"(Ref: 560256)";"Buddy Pet";"Bandeja para Arena Sanitaria de Gatos 43X32X14 Cm";"";"$4.990"
"348";"(Ref: 267971)";"Champion Cat";"Alimento Seco para Gatos Adultos Pescado Bolsa";"3 Kg";"$8.090"
"349";"(Ref: 613426)";"Purina One";"Alimento Seco Gato Metabolismo Saludable Sabor Pavo";"3,17 Kg";"$15.650"
"350";"(Ref: 520610)";"Master Cat";"Arena Sanitaria Gato Bolsa";"4 Kg";"$6.190"
"351";"(Ref: 517138)";"Cat Chow";"Alimento Seco para Gato Adulto Pescado";"3 Kg";"$9.250"
"352";"(Ref: 538172)";"Cubi Cat";"Alimento Gato Adulto con Vitaminas y Minerales Bolsa";"1 Kg";"$1.090"
"353";"(Ref: 509610)";"Cat Chow";"Alimento Seco para Gatitos De 1 a 12 Meses";"8 Kg";"$21.590"
"354";"(Ref: 609611)";"Champion Cat";"Cristales  Sanitarios";"1,6 Kg";"$5.990"
"355";"(Ref: 265938)";"Champion Cat";"Alimento Seco para Gatos de Sabores Del Campo Bolsa";"3 Kg";"$8.090"
"356";"(Ref: 512928)";"Loops";"Arena Sanitaria para Gatos Pellet de Pino Bolsa";"4,5 Kg";"$3.190"
"357";"(Ref: 236653)";"Master Cat";"Alimento Seco Salmón para Gato Bolsa";"8 Kg";"$17.590"
"358";"(Ref: 236678)";"Master Cat";"Alimento Seco Sabor Carne para Gato Bolsa";"3 Kg";"$6.290"
"359";"(Ref: 472158)";"Champion Cat";"Alimento Seco para Gatos Indoor Pollo & Salmón Bolsa";"3 Kg";"$8.790"
"360";"(Ref: 655367)";"Tidy Cats";"Arena Sanitaria Light Weight";"2,7 Kg";"$9.890"
"361";"(Ref: 584520)";"Cat Chow";"Alimento Gato Adulto Deli Mix Bolsa";"1 Kg";"$3.690"
"362";"(Ref: 266015)";"Champion Cat";"Alimento Seco para Gatos Pequeños Sabor Carne & Leche Bolsa";"1 Kg";"$2.450"
"363";"(Ref: 637036)";"Felix";"Felix Adulto Salmon En Salsa";"85 g";"$500"
"364";"(Ref: 577380)";"Master Cat";"Alimento Húmedo Gato Atún Blanco Filetitos en Salsa Lata";"85 g";"$670"
"365";"(Ref: 515039)";"Tidy Cats";"Arena Sanitaria para Gatos Inatant Action Bidón";"6,35 Kg";"$8.190"
"366";"(Ref: 613420)";"Purina One";"Alimento Seco Gatito Fórmula Saludable Sabor Pollo";"3,17 Kg";"$15.650"
"367";"(Ref: 504998)";"Gati";"Alimento Seco para Gato Arroz y Espinaca";"3 Kg";"$6.250"
"368";"(Ref: 629587)";"Champion Cat";"Cristales Aglomerantes";"1,8 kg";"$5.790"
"369";"(Ref: 648742)";"Felix";"Felix Adulto Pescado Blanco En Salsa";"85 g";"$500"
"370";"(Ref: 444942)";"White Cat";"Arena Sanitaria para Gatos Bolsa";"4 Kg";"$5.290"
"371";"(Ref: 648744)";"Felix";"Felix Adulto Atún En Salsa";"85 g";"$500"
"372";"(Ref: 608972)";"Cat Chow";"Alimento Seco Gato Peso Saludable Bolsa";"3 Kg";"$11.190"
"373";"(Ref: 260032)";"Master Cat";"Alimento Seco Sabor Pollo Carne y Leche para Gato Bolsa";"3 Kg";"$6.290"
"374";"(Ref: 544660)";"Champion Cat";"Alimento Gato Indoor Paté Salmón Lata";"315 g";"$1.190"
"375";"(Ref: 447506)";"Master Cat";"Alimento para Gatos Adultos Trocitos Jugosos Sabor Salmón Ahumado Sobre";"85 g";"$460"
"376";"(Ref: 447505)";"Master Cat";"Alimento para Gatos Adultos Trocitos Jugosos Sabor Carne Asada Sobre";"85 g";"$460"
"377";"(Ref: 520233)";"Master Cat";"Trocitos Jugosos Gatitos Carne - Leche Sobre";"85 g";"$460"
"378";"(Ref: 691410)";"Felinnes";"Alimento húmedo para Gatitos - Sabor Carne y Leche";"85 g";"$470"
"379";"(Ref: 691409)";"Felinnes";"Alimento húmedo para Gatos - Sabor Salmón";"85 g";"$470"
"380";"(Ref: 691408)";"Felinnes";"Alimento húmedo para Gatos - Sabor Carne";"85 g";"$470"
"381";"(Ref: 590560)";"Whiskas";"Alimento Húmedo para Gatos Adulto Sabor Pescado Bolsa";"85 g";"$480"
"382";"(Ref: 590561)";"Whiskas";"Alimento Húmedo para Gatitos Sabor Carne Sobre";"85 g";"$480"
"383";"(Ref: 590559)";"Whiskas";"Alimento Húmedo para Gatos Adulto Sabor Carne Sobre";"85 g";"$480"
"384";"(Ref: 254903)";"Whiskas";"Alimento Húmedo para Gatos Adultos Sabor Pavo Bolsa";"85 g";"$480"
"385";"(Ref: 333314)";"Whiskas";"Alimento Húmedo para Gato Sabor Sardina Sobre";"85 g";"$480"
"386";"(Ref: 647068)";"Champion Cat";"Alimento con Trocitos en Salsa Sabor Pollo";"100 g";"$490"
"387";"(Ref: 467646)";"Champion Cat";"Alimento con Trocitos en Salsa Sabor Salmón Pouch";"100 g";"$490"
"388";"(Ref: 647067)";"Champion Cat";"Alimento con Trocitos en Salsa Sabor Pollo y Pavo";"100 g";"$490"
"389";"(Ref: 647066)";"Champion Cat";"Alimento Indoor para Gatos Hogareños o Esterilizados Sabor Atún";"100 g";"$490"
"390";"(Ref: 495826)";"Champion Cat";"Alimento con Trocitos en Salsa Sabor Carne Pouch";"100 g";"$490"
"391";"(Ref: 647065)";"Champion Cat";"Alimento con Trocitos en Salsa Sabor Atún y Salmón";"100 g";"$490"
"392";"(Ref: 637042)";"Felix";"Felix Adulto Cordero En Salsa";"85 g";"$500"
"393";"(Ref: 637031)";"Felix";"Felix Adulto Carne En Salsa";"85 g";"$500"
"394";"(Ref: 648740)";"Felix";"Felix Adulto Pavo En Salsa";"85 g";"$500"
"395";"(Ref: 648741)";"Felix";"Felix Adulto Pollo En Salsa";"85 g";"$500"
"396";"(Ref: 637041)";"Felix";"Felix Gatito Pescado En Salsa";"85 g";"$500"
"397";"(Ref: 637040)";"Felix";"Felix Gatito Pollo En Salsa";"85 g";"$500"
"398";"(Ref: 637043)";"Felix";"Felix Adulto Sardina En Salsa";"85 g";"$500"
"399";"(Ref: 637039)";"Felix";"Felix Gatito Carne En Salsa";"85 g";"$500"
"400";"(Ref: 671435)";"Cat Chow";"Alimento Gatos Esterilizado Carne Pouch";"85 g";"$560"
"401";"(Ref: 671436)";"Cat Chow";"Alimento Gatos Esterilizado Pescado Pouch";"85 g";"$560"
"402";"(Ref: 671432)";"Cat Chow";"Alimento Gato Pescado Pouch";"85 g";"$560"
"403";"(Ref: 671430)";"Cat Chow";"Alimento Gatito Carne Pouch";"85 g";"$560"
"404";"(Ref: 671434)";"Cat Chow";"Alimento Gato Pollo Pouch";"85 g";"$560"
"405";"(Ref: 671431)";"Cat Chow";"Alimento Gatito Pollo Pouch";"85 g";"$560"
"406";"(Ref: 671433)";"Cat Chow";"Alimento Gato Carne Pouch";"85 g";"$560"
"407";"(Ref: 577378)";"Master Cat";"Alimento Húmedo Gato Atún Rojo con Camarón en Salsa Lata";"85 g";"$670"
"408";"(Ref: 577379)";"Master Cat";"Alimento Húmedo Gato Atún Rojo con Salmón en Salsa Lata";"85 g";"$670"
"409";"(Ref: 556763)";"Champion Cat";"Alimento Gato Adulto Filetitos de Pollo Lata";"80 g";"$690"
"410";"(Ref: 556761)";"Champion Cat";"Alimento Gato Adulto Filetitos de Pollo y Verduras Lata";"80 g";"$690"
"411";"(Ref: 556762)";"Champion Cat";"Alimento Gato Adulto Filetitos de Pavo Lata";"80 g";"$690"
"412";"(Ref: 556760)";"Champion Cat";"Alimento Gato Adulto Filetitos de Pavo y Zanahoria Lata";"80 g";"$690"
"413";"(Ref: 580660)";"Master Cat";"Alimento Húmedo para Gatos Sabor Salmón 130 g";"300 g";"$730"
"414";"(Ref: 475836)";"Felix";"Alimento Húmedo Gato Paté Pescado y Atún";"156 g";"$730"
"415";"(Ref: 475838)";"Felix";"Alimento Húmedo Gato Filetes Pescado/Atún";"156 g";"$730"
"416";"(Ref: 475837)";"Felix";"Alimento Húmedo para Gatos Paté Salmón";"156 g";"$730"
"417";"(Ref: 258740)";"Master Cat";"Alimento Húmedo para Gatos de Todas las Edades Carne Pote";"300 g";"$730"
"418";"(Ref: 475840)";"Felix";"Alimento Húmedo Gato Paté Pavo/Menudencia";"156 g";"$730"
"419";"(Ref: 475839)";"Felix";"Alimento Húmedo Gato Trocitos de Pollo";"156 g";"$730"
"420";"(Ref: 497765)";"Fancy Feast";"Mini trozos de Pollo con Salsa";"85 g";"$750"
"421";"(Ref: 497766)";"Fancy Feast";"Mini filetes de Trucha con Espinaca en Salsa";"85 g";"$750"
"422";"(Ref: 497768)";"Fancy Feast";"Mini filetes de Salmón con Salsa";"85 g";"$750"
"423";"(Ref: 497767)";"Fancy Feast";"Mini trozos de Pollo con Zanahoria en Salsa";"85 g";"$750"
"424";"(Ref: 691566)";"Master Cat";"Snack Sabor Pollo";"60 g";"$890"
"425";"(Ref: 560257)";"Buddy Pet";"Pala para Arena Sanitaria";"";"$890"
"426";"(Ref: 548043)";"Fit";"Snacks Mix Pescado para Gato Bolsa";"65 g";"$970"
"427";"(Ref: 640361)";"Cat Chow";"Alimento Seco Gato Adulto Delimix";"500 g";"$1.000"
"428";"(Ref: 640364)";"Cat Chow";"Alimento Seco Gato Adulto Sabor Pescado";"500 g";"$1.000"
"429";"(Ref: 640368)";"Cat Chow";"Alimento Seco Gatito";"500 g";"$1.000"
"430";"(Ref: 640358)";"Cat Chow";"Alimento Seco Gato Adulto Sabor Carne";"500 g";"$1.000"
"431";"(Ref: 560251)";"Buddy Pet";"Plato Doble para Perro Tamaño S";"";"$1.090"
"432";"(Ref: 579224)";"Fit";"Alimento Húmedo Gatos Sabor Pollo Lata";"290 g";"$1.190"
"433";"(Ref: 269553)";"Champion Cat";"Alimento Húmedo sabor Mar para Gato Adulto Lata";"315 g";"$1.190"
"434";"(Ref: 544661)";"Champion Cat";"Alimento Gato Paté Sabor Pollo Lata";"315 g";"$1.190"
"435";"(Ref: 266003)";"Champion Cat";"Alimento Húmedo Sabor de Carne Para Gato Adulto Lata";"315 g";"$1.190"
"436";"(Ref: 560264)";"Buddy Pet";"Juguete para Gato Caña con Sisal";"";"$1.250"
"437";"(Ref: 560259)";"Buddy Pet";"Juguete para Gato Caña y Pelota";"";"$1.390"
"438";"(Ref: 560265)";"Buddy Pet";"Juguete para Gato Caña con Sisal Natural";"";"$1.490"
"439";"(Ref: 560250)";"Buddy Pet";"Plato Doble para Perro Tamaño M";"";"$1.490"
"440";"(Ref: 560260)";"Buddy Pet";"Juguete para Gato Caña con Figura";"";"$1.490"
"441";"(Ref: 560258)";"Buddy Pet";"Guante Masajeador para Mascotas";"";"$1.490"
"442";"(Ref: 665074)";"Naturalistic";"Duck Cubes Cats";"50 g";"$1.590"
"443";"(Ref: 560266)";"Buddy Pet";"Juguete para Gatos";"2 Ratones";"$1.590"
"444";"(Ref: 560263)";"Buddy Pet";"Juguete para Gato Mazorca de Maíz";"";"$1.590"
"445";"(Ref: 665075)";"Naturalistic";"Salmon Chips Cat";"50 g";"$1.590"
"446";"(Ref: 526138)";"Acuenta";"Arena Sanitaria para Gatos Bolsa";"2 Kg";"$1.650"
"447";"(Ref: 560267)";"Buddy Pet";"Juguete para Gatos 4 Pelotas Campanas";"";"$1.690"
"448";"(Ref: 560261)";"Buddy Pet";"Juguete para Gato Figura Plush";"";"$1.790"
"449";"(Ref: 560262)";"Buddy Pet";"Juguete para Gato Ratones de Colores";"";"$1.790"
"450";"(Ref: 560268)";"Buddy Pet";"Shampoo Seco Repelente Pulgas para Gatos Eucalipto";"100 g";"$1.990"
"451";"(Ref: 689156)";"Buddy Pet";"Guante masajeador para Mascotas";"1 Un";"$1.990"
"452";"(Ref: 689151)";"Buddy Pet";"Juguete para Gato";"1 Un";"$1.990"
"453";"(Ref: 268233)";"Champion Cat";"Alimento Seco para Gatos Pequeños Sabor Pollo & Leche Bolsa";"1 Kg";"$2.150"
"454";"(Ref: 267980)";"Champion Cat";"Alimento para Gatos Adultos Sabor del Mar Bolsa";"1 Kg";"$2.150"
"455";"(Ref: 265955)";"Champion Cat";"Alimento Seco para Gatos Adultos Sabores del Campo Bolsa";"1 Kg";"$2.150"
"456";"(Ref: 255180)";"Whiskas";"Alimento para Gatos Carne y Leche Bolsa";"1 Kg";"$2.390"
"457";"(Ref: 472157)";"Champion Cat";"Alimento Seco De Pollo y Salmón Bolsa";"1 Kg";"$2.450"
"458";"(Ref: 560249)";"Buddy Pet";"Plato para Gato Tamaño S";"";"$2.490"
"459";"(Ref: 689137)";"Buddy Pet";"Juguete Tablero para Rasguñar Gato";"1 Un";"$2.590"
"460";"(Ref: 236354)";"Drag Pharma";"Collar antiparasitario Gato";"1 Un";"$2.690"
"461";"(Ref: 560271)";"Buddy Pet";"Eliminador Olor de Orina de Gatos Botella";"230 ml";"$2.690"
"462";"(Ref: 504997)";"Gati";"Alimento Seco para Gato Arroz y Espinaca";"1 Kg";"$2.790"
"463";"(Ref: 560248)";"Buddy Pet";"Plato para Gato Tamaño L";"";"$2.790"
"464";"(Ref: 691067)";"Felinnes";"Alimento seco para Gatos - Sabor Salmón";"1 Kg";"$2.890"
"465";"(Ref: 691068)";"Felinnes";"Alimento seco para Gatos - Sabor carne";"1 Kg";"$2.890"
"466";"(Ref: 655371)";"Bionic";"Set de Juegos para Gatos";"1 Un";"$2.990"
"467";"(Ref: 689149)";"Buddy Pet";"Juguete para Gato";"1 Un";"$2.990"
"468";"(Ref: 236665)";"Master Cat";"Alimento Seco para Gatos Adultos Sabor Carne Bolsa";"1 Kg";"$2.990"
"469";"(Ref: 258708)";"Master Cat";"Alimento Seco para Gatos Adultos Sabor Pollo-Carne Bolsa";"1 Kg";"$2.990"
"470";"(Ref: 263826)";"Master Cat";"Alimento para Gatos Adultos Sabor Salmón & Sardina Bolsa";"1 Kg";"$2.990"
"471";"(Ref: 691066)";"Felinnes";"Alimento seco para Gatitos - Sabor Carne y Leche";"1 Kg";"$3.190"
"472";"(Ref: 257769)";"Sinpul";"Antiparasito Externo para Gatos Frasco";"100 g";"$3.190"
"473";"(Ref: 263875)";"Whiskas";"Alimento Seco sabor Atún y Sardina para Gato Whiskas";"1 Kg";"$3.350"
"474";"(Ref: 255138)";"Whiskas";"Alimento Seco para Gato Adulto Sabor Carne Bolsa";"1 Kg";"$3.350"
"475";"(Ref: 335674)";"Whiskas";"Alimento Seco sabor Pollo y Leche para Gato Whiskas";"1 Kg";"$3.350"
"476";"(Ref: 243776)";"Whiskas";"Alimento Seco para Gato Adulto Sabor Salmón Bolsa";"1 Kg";"$3.350"
"477";"(Ref: 577389)";"Traper ";"Shampoo Espuma Seca para Gatos Frasco";"170 ml";"$3.490"
"478";"(Ref: 236740)";"Master Cat";"Alimento para Gatitos Completo y Balanceado Bolsa";"1 Kg";"$3.490"
"479";"(Ref: 444696)";"Loops";"Arena Sanitaria para Gatos Bolsa";"4,5 Kg";"$3.590"
"480";"(Ref: 509592)";"Cat Chow";"Alimento Seco para Gato Adulto Pescado";"1 Kg";"$3.690"
"481";"(Ref: 658885)";"Traper";"Arena Sanitaria para gatos";"4 Kg";"$3.990"
"482";"(Ref: 655397)";"Hello Kitty";"Arena Sanitaria Gato Clasica";"2 Kg";"$3.990"
"483";"(Ref: 509600)";"Cat Chow";"Alimento Seco para Gatos Adultos Hogareños";"1 Kg";"$4.050"
"484";"(Ref: 560252)";"Buddy Pet";"Juguete para Gato Pelota";"";"$4.490"
"485";"(Ref: 548296)";"Petfy";"Placa con QR";"1 Un";"$4.590"
"486";"(Ref: 560270)";"Buddy Pet";"Eliminador Olores de Mascotas Botella";"1 L";"$4.990"
"487";"(Ref: 560269)";"Buddy Pet";"Repelente para Mascotas Botella";"1 L";"$4.990"
"488";"(Ref: 560255)";"Buddy Pet";"Tablero de Rasguño para Gato Forma de Ardilla";"";"$4.990"
"489";"(Ref: 599507)";"Petfy";"Collar con QR - Mini";"1 Un";"$4.990"
"490";"(Ref: 577390)";"Traper";"Repelente Perros y Gatos Lata";"440 cc";"$5.190"
"491";"(Ref: 296817)";"Drag Pharma";"Arena para Gatos Ultra Fresh";"1.59 Kg";"$5.590"
"492";"(Ref: 691064)";"Felinnes";"Alimento seco para Gatos - Sabor carne";"3 Kg";"$5.950"
"493";"(Ref: 691065)";"Felinnes";"Alimento seco para Gatos - Sabor Salmón";"3 Kg";"$5.950"
"494";"(Ref: 655396)";"Hello Kitty";"Arena Sanitaria Gato Biodegradable";"2 Kg";"$5.990"
"495";"(Ref: 691565)";"Master Cat";"Alimento Seco Gato Adulto Sabor Salmón";"3 Kg";"$6.490"
"496";"(Ref: 655496)";"Fresh Step";"Arena Para Gatos No Aglomerante";"3.2 Kg";"$6.490"
"497";"(Ref: 650255)";"Master Cat";"Alimento Gato Hogareño Sabor Salmón";"3 Kg";"$6.490"
"498";"(Ref: 560253)";"Buddy Pet";"Tablero de Rasguño para Gato Forma de Ratón";"";"$6.890"
"499";"(Ref: 339709)";"Whiskas";"Alimento para Gatos Pollo y Leche Whiskas Saco";"3 Kg";"$7.150"
"500";"(Ref: 255117)";"Whiskas";"Whiskas Atún y Sardina Whiskas Saco";"3 Kg";"$7.150"
"501";"(Ref: 656254)";"Bionic";"Alimento Gato Adulto Sabores Marinos";"3 Kg";"$7.390"
"502";"(Ref: 560254)";"Buddy Pet";"Tablero de Rasguño para Gato Forma de Pescado";"";"$7.890"
"503";"(Ref: 268220)";"Champion Cat";"Alimento Seco para Gatos Sabor Original Bolsa";"3 Kg";"$8.090"
"504";"(Ref: 236324)";"Drag Pharma";"Fiprodrag Gatos";"0.5 ml";"$8.390"
"505";"(Ref: 690866)";"Champion Cat";"Arena Sanitaria para Gato Ecoplus";"3,6 Kg";"$8.790"
"506";"(Ref: 640359)";"Cat Chow";"Alimento Seco para Gato Adulto Carne";"3 Kg";"$9.250"
"507";"(Ref: 613425)";"Purina One";"Alimento Seco Gato Metabolismo Saludable Sabor Pavo";"1600 g";"$9.390"
"508";"(Ref: 613419)";"Purina One";"Alimento Seco Gatito Fórmula Saludable Sabor Pollo";"1600 g";"$9.390"
"509";"(Ref: 613421)";"Purina One";"Alimento Seco Gato Sabor Salmón y Atún";"1600 g";"$9.390"
"510";"(Ref: 613423)";"Purina One";"Alimento Seco Gato Sistema Sensible Sabor Pollo";"1600 g";"$9.390"
"511";"(Ref: 670291)";"Cat Chow";"Alimento Seco Gato Esterilizado Bolsa";"3 Kg";"$10.450"
"512";"(Ref: 670290)";"Cat Chow";"Alimento Seco para Gatitos De 1 a 12 Meses";"3 Kg";"$11.490"
"513";"(Ref: 665420)";"Bionic";"Alimento Gato Adulto Sabores Marinos";"8 Kg";"$13.990"
"514";"(Ref: 254285)";"Whiskas";"Alimento Seco Sabor Atún y Sardina para Gato Bolsa";"6 Kg";"$15.390"
"515";"(Ref: 613422)";"Purina One";"Alimento Seco Gato Sabor Salmón y Atún";"3,17 Kg";"$15.650"
"516";"(Ref: 613424)";"Purina One";"Alimento Seco Gato Sistema Sensible Sabor Pollo";"3,17 Kg";"$15.650"
"517";"(Ref: 236712)";"Master Cat";"Alimento Seco Para Gato Adulto Sabor Pollo Bolsa";"8 Kg";"$17.590"
"518";"(Ref: 467345)";"Loops";"Viruta Vegetal para Animales Bolsa";"2 Kg";"$1.590"
"519";"(Ref: 269854)";"Mini Pets";"Alimento para Conejos, Chinchillas y Cuyes";"1 Kg";"$1.250"
"520";"(Ref: 269864)";"Mini Pets";"Alimento Hámsters y Jerbos Bolsa";"500 g";"$990"
"521";"(Ref: 269819)";"Mini Pets";"Alimento para Canarios Bolsa";"500 g";"$1.090"
"522";"(Ref: 269808)";"Mini Pets";"Alimento para Catitas Bolsa";"500 g";"$1.090"
"523";"(Ref: 269841)";"Mini Pets";"Semillas de Alpiste Seleccionadas Bolsa";"500 g";"$1.250"
"524";"(Ref: 269831)";"Mini Pets";"Semillas de Maravilla Seleccionadas Bolsa";"500 g";"$1.250"
"525";"(Ref: 269875)";"Mini Pets";"Viruta para Mascotas Bolsa";"800 g";"$1.390"
"526";"(Ref: 467351)";"Loops";"Alimento para Conejos Bolsa";"1 Kg";"$1.490"
"527";"(Ref: 467349)";"Loops";"Alimento Completo para Canarios Bolsa";"1 Kg";"$1.790"
"528";"(Ref: 467348)";"Loops";"Alimento Alpiste Bolsa";"1 Kg";"$1.990"
"529";"(Ref: 467350)";"Loops";"Alimentos para Catitas Bolsa";"1 Kg";"$1.990"
"530";"(Ref: 467353)";"Loops";"Alimento para Hamsters y Jerbos Bolsa";"1 Kg";"$1.990"
"531";"(Ref: 646874)";"Buddy Pet";"Alimento para Peces - Basic";"50 g";"$3.790"
